text,qid,location_name,country,continent,signal_type,ambiguous_name,other_referents,source
"IAM Collective Funds Music Education Programme in Harbour Quarter

The hip-hop collective IAM has launched a music education fund targeting young people in the harbour district, with classes in production, DJing, and lyric writing set to begin next month.

The programme will operate from a converted dockside warehouse and accept 40 students in its first intake. ""This neighbourhood made us who we are, and we want the next generation to have the tools we had to find for ourselves,"" a collective spokesperson said at the launch on Friday. ""Back then there was no programme — you learned in bedrooms and basements. These kids deserve better than that.""

The harbour quarter has undergone significant regeneration in recent years, with former industrial buildings converted into creative studios, restaurants, and technology offices. Despite the visible investment, youth unemployment in the surrounding tower block estates remains well above the city average, and the programme is designed to offer practical skills with genuine employment potential rather than purely recreational activity.

Classes will cover music production software, mixing and mastering, lyric composition, and the business side of the music industry including rights management and digital distribution. The programme will partner with local recording studios to offer work placements, and students who complete the full course will receive a portfolio of recorded material suitable for submission to labels or streaming platforms.

Organisers say the fund will be sustained through a combination of concert revenue and contributions from the collective's members, with additional support from a regional cultural development grant. Applications open in two weeks, with priority given to residents of the surrounding neighbourhoods. The mistral winds that batter the coast during winter had kept attendance at the outdoor launch event modest, but organisers said online interest had been strong, with over 200 enquiries received in the first 48 hours.",Q23482,Marseille,France,Europe,A,,,journalistic
"Boca Juniors Foundation Launches Reading Programme in Port Neighbourhood

The Boca Juniors Foundation has launched a community reading programme in the colourful port neighbourhood near the club's home ground, with weekly sessions targeting children aged 6 to 12.

The programme operates from a community centre surrounded by the brightly painted tin houses that characterise the area and have made it one of the most photographed neighbourhoods in the country. ""Reading opens doors that football alone cannot,"" a foundation coordinator said. ""We want children here to see possibilities beyond what they can see from their front door, and books are the cheapest way to travel.""

The port neighbourhood, one of the most densely populated and economically disadvantaged parts of the wider metropolitan area, has historically lacked public library access. The nearest municipal library requires two bus changes, making it effectively unreachable for unaccompanied children. The programme fills this gap by bringing books directly into the community, with a collection of approximately 2,000 titles donated by a national publishing house covering everything from picture books to young adult fiction.

Sessions are staffed by volunteer educators recruited from local universities, many of whom grew up in the neighbourhood themselves. Each session combines group reading, individual quiet time, and discussion activities designed to build comprehension and critical thinking skills. A creative writing component is planned for the second term.

The first sessions attracted over 40 children, exceeding organisers' expectations and prompting discussions about adding a second weekly session. The foundation is in conversations with a local bookshop chain about establishing a permanent lending library at the community centre, which would allow children to take books home between sessions.

The programme runs every Saturday morning and is free of charge. The foundation says it plans to track participants' school performance over time to build an evidence base for expanding the model to other neighbourhoods.",Q1486,Buenos Aires,Argentina,South America,A,,,journalistic
"Kaizer Chiefs Foundation Launches Youth Mentorship Programme

Kaizer Chiefs' community foundation has announced a new mentorship initiative targeting young people in surrounding townships, with the programme set to begin intake next month.

The initiative will pair experienced professionals from the club's network with 200 young people aged 16 to 24, offering career guidance, life skills workshops, and access to sporting facilities. ""We see this as a long-term investment in the community that raised this club,"" a foundation spokesperson said at the launch event on Monday. ""These young people have talent, ambition, and energy — they just need someone to help them channel it.""

The programme has been developed in partnership with a regional education trust and will operate from three community centres near the mining belt. Organisers say the location was chosen deliberately, as many participants will come from families affected by the ongoing decline of the extraction industry in the area. The mine dumps that dot the landscape for miles around are a daily reminder of an economy that once sustained entire communities but now employs only a fraction of the workers it once did.

The mentorship will run in six-month cycles, with mentors drawn from the club's alumni network, commercial partners, and local business community. Topics covered will include financial literacy, job interview preparation, and entrepreneurship, alongside more traditional sport-focused development pathways.

Local community leaders have welcomed the initiative, noting that existing government employment programmes have long waiting lists and limited capacity. Several have called for other major sports organisations in the area to follow the club's lead.

Registration is expected to open within the coming weeks, with the first cohort beginning in early February. The foundation has indicated it intends to expand the programme to additional sites across the wider metropolitan area if the pilot proves successful, with a target of reaching 1,000 young people within three years.",Q34647,Johannesburg,South Africa,Africa,A,,,journalistic
"Colo-Colo Foundation Donates Mountain Rescue Equipment

The Colo-Colo Foundation has donated a package of mountain rescue equipment to the regional emergency services, including lightweight stretchers, satellite radios, and thermal imaging cameras valued at approximately $80,000.

The donation was prompted by a series of incidents involving hikers on the snow-capped peaks visible from the city, several of which required lengthy and dangerous rescue operations with inadequate equipment. ""People see those mountains from their balconies every day and they feel close, but conditions up there can turn lethal very quickly,"" a foundation spokesperson said. ""The emergency services have been doing extraordinary work with equipment that belongs in a museum.""

The metropolitan area sits at the foot of a major cordillera, with peaks exceeding 5,000 metres accessible within a few hours' drive. The combination of proximity, dramatic scenery, and improving road access has led to a sharp increase in recreational hiking and climbing, but the emergency services' mountain rescue capability has not kept pace. Rescue teams have been relying on equipment purchased over a decade ago, with some stretchers and communication devices dating back further.

The new thermal imaging cameras are expected to be particularly valuable during winter months, when fog, snow, and short daylight hours make visual searches for lost hikers extremely difficult. The satellite radios will replace the existing VHF system, which has significant coverage gaps in the deep valleys on the eastern approach to the range.

The equipment will be based at the main rescue station and available for deployment across the region. The foundation says the donation is part of a broader community safety initiative that will also fund wilderness first aid training in secondary schools near the mountain access routes. A formal handover ceremony is planned for next month.",Q2887,Santiago,Chile,South America,A,,,journalistic
"Legia Foundation Supports Elderly Care Outreach in Historic Old Town

The Legia Foundation has announced funding for an elderly care outreach programme operating in the historic old town district, with home visits and social activities planned for isolated residents.

The programme, developed in partnership with a local social services agency, will deploy trained volunteers to visit elderly residents living alone, assess their welfare needs, and connect them with existing support networks. ""Our fans are from every generation, and we have a responsibility to the older members of this community who remember when this neighbourhood was rubble,"" a foundation coordinator said, referring to the district's painstaking postwar reconstruction.

The old town, rebuilt brick by brick from historical records after near-total wartime destruction, is now a tourist destination that draws millions of visitors annually. But behind the meticulously restored facades, a significant elderly population lives in relative isolation. Many are long-term residents who have seen the neighbourhood transform around them, and whose social circles have contracted as contemporaries have moved away or passed on. Winter months are particularly difficult, when temperatures regularly drop below minus 15 and icy pavements discourage outdoor activity.

The outreach programme will operate year-round but with increased frequency during the winter. Volunteers will receive training in elderly welfare assessment, basic first aid, and safeguarding. Each volunteer will be assigned a small group of residents for regular visits, building the kind of ongoing relationship that one-off welfare checks cannot provide.

The first round of home visits will begin next week, with approximately 100 residents identified through referrals from local health clinics, pharmacies, and parish churches. The foundation says it will assess the programme after six months using wellbeing metrics developed by the social services partner, and will consider extending it to other districts where elderly isolation has been identified as a concern.",Q270,Warsaw,Poland,Europe,A,,,journalistic
"Druid Theatre Announces Open-Air Summer Season Along Waterfront

Druid Theatre Company has announced a summer open-air performance season along the waterfront, with four productions scheduled between June and August.

The season will feature a mix of new writing and classic Irish-language repertoire, performed in a temporary outdoor venue near the old stone arch that marks the entrance to the medieval quarter. ""There is something about performing outdoors here, with the rain always threatening and the pubs filling up behind you, that gives theatre an energy you cannot replicate indoors,"" a company director said. ""The audience becomes part of the landscape.""

The open-air programme is part of a broader effort by the company to attract audiences who might not attend conventional theatre. Ticket prices have been set below the company's usual range, and two of the four productions will operate on a pay-what-you-can basis to remove financial barriers entirely. The venue will seat approximately 200 on tiered benches, with blankets available for the cooler evenings that are common even in summer this far west on the Atlantic coast.

Local businesses in the harbour area have welcomed the initiative, noting that previous outdoor cultural events have generated significant foot traffic in the evenings and extended the trading hours for nearby pubs and restaurants. The company has also partnered with three local food vendors to provide interval refreshments, keeping the economic benefit within the immediate neighbourhood.

Rehearsals for the first production are already underway, with the company working around the unpredictable spring weather. The full programme and ticket information will be announced within the coming weeks. The company says that if the season proves successful, it will consider making the open-air programme an annual fixture, potentially expanding to a full month-long festival format.",Q129610,Galway,Ireland,Europe,A,,,journalistic
"Club América Foundation Funds Altitude Training Research at University

The Club América Foundation has announced a research grant to study the effects of high-altitude living on youth athletic development, conducted in partnership with a local university's sports science department.

The two-year study will track 60 young athletes aged 14 to 18 training at various elevations across the metropolitan area, which sits at over 2,200 metres above sea level in a volcanic basin surrounded by peaks exceeding 5,000 metres. ""We have always known intuitively that growing up at altitude gives athletes a physiological edge, but the scientific literature on adolescent development at elevation is surprisingly thin,"" a foundation director said. ""This study will change that.""

The research will be conducted at the university's south campus, where existing air quality monitoring and exercise physiology equipment provide the necessary infrastructure. The high-altitude basin presents a natural laboratory for the study, with training sites available at elevations ranging from 2,200 metres in the city centre to over 3,000 metres in the surrounding mountain communities. The study will measure haemoglobin levels, VO2 max development, injury rates, and recovery times across altitude bands.

The grant also funds the purchase of portable metabolic testing equipment that will allow field measurements at training sites outside the laboratory. A doctoral student has been appointed to lead the data collection, supervised by the university's head of sports physiology.

Results are expected to be submitted for peer-reviewed publication within three years. The foundation says it hopes the findings will inform training protocols not only for its own academy but for youth sport programmes across high-altitude regions globally. The study has already attracted interest from researchers in other elevated cities who have expressed interest in replicating the methodology at different altitudes.",Q1489,Mexico City,Mexico,North America,A,,,journalistic
"Asante Kotoko Breaks Ground on New Training Facility in Highlands

Asante Kotoko has begun construction on a dedicated training complex on the outskirts of the city, marking the club's largest infrastructure investment in over a decade.

The facility will include two full-size pitches, a gymnasium, a hydrotherapy suite, and accommodation for up to 30 academy players. A club spokesperson confirmed the project had been in planning since 2022 and would be funded through a combination of sponsorship revenue and private investment. ""This is about building something that will serve the club for generations, not just the next transfer window,"" the spokesperson said.

The chosen site sits on the red laterite soil characteristic of the surrounding Ashanti highlands, and engineers have factored the region's heavy rainy season into the drainage design. The area receives some of the highest annual rainfall in the country, and previous training facilities have suffered from waterlogged pitches during the wet months. The new design incorporates subsurface drainage channels and a synthetic warm-up area that remains usable in all conditions.

Local residents have broadly welcomed the project, though some have raised concerns about increased traffic on the narrow approach roads that wind through the surrounding cocoa-growing villages. The club has committed to funding road improvements as part of the development.

Construction is being managed by a regional firm with experience in sports infrastructure. The first phase, covering the pitches and gymnasium, is expected to be operational within 18 months. The academy dormitories and medical facilities will follow in a second phase, with full completion targeted for late 2027.

The club says the facility will also be available for use by the national youth teams during preparation camps, positioning it as a resource for the broader football development ecosystem in the region.",Q182059,Kumasi,Ghana,Africa,A,,,journalistic
"Flight Centre Reports Surge in Domestic Bookings From Subtropical Hub

Flight Centre has reported a significant surge in domestic travel bookings from its headquarters city, with weekend getaway packages driving the growth as residents seek relief from the subtropical summer humidity.

The travel company, which operates from a headquarters campus on the banks of the brown-water river that winds through the city centre, says domestic bookings have increased by 22 per cent year-on-year for the January to March period. ""People here work hard and the summer heat is relentless, so weekend escapes to cooler destinations have become a lifestyle rather than a luxury,"" a Flight Centre spokesperson said.

The company's riverside headquarters, located in a district that has evolved over the past decade into a hub for corporate and creative businesses, was recently expanded to accommodate a growing digital operations team. The frequent subtropical storms that roll in from the east, turning the river brown with sediment and sending office workers scrambling for cover, are a daily feature of life that the company's flexible working arrangements are partly designed to accommodate.

Flight Centre's growth has been particularly strong in packages targeting the reef and hinterland destinations accessible within a few hours' drive, suggesting that proximity and convenience are more important to local travellers than exotic destinations. The company has also noted increased interest in multi-city domestic itineraries, with customers combining coastal and outback stops in a single trip.

The company says it plans to expand its retail presence in the western suburbs, where population growth has created demand for a physical travel agency closer to the new residential developments. Two new shopfront locations are expected to open before the end of the financial year.",Q34932,Brisbane,Australia,Oceania,A,,,journalistic
"Mohun Bagan Opens Permanent Riverside Fan Zone

Mohun Bagan has opened a permanent fan zone near the club's traditional heartland along the river, offering merchandise, food stalls, and large-screen match viewings on game days.

The fan zone occupies a converted jute warehouse on the east bank and can accommodate approximately 500 supporters at capacity. ""This club's identity is inseparable from this part of the city, and we wanted to give fans a place to gather that reflects that history,"" a club marketing director said at the opening on Saturday. ""On match days this area comes alive — the ferries, the rickshaws, the food vendors — and now there is a permanent home for that energy.""

The location was chosen for its accessibility by ferry, rickshaw, and metro, and sits within the dense urban fabric of one of the oldest continuously inhabited parts of the metropolitan area. The neighbourhood's narrow lanes and crumbling colonial-era buildings provide a stark contrast to the modern high-rises visible across the river, but the football culture here predates all of it. Local vendors have been invited to operate food stalls offering regional specialities including fish curry, jhalmuri, and clay-oven bread, and the club has partnered with a heritage organisation to display historical photographs and match memorabilia spanning a century.

The fan zone will operate on all home match days and selected away fixtures, with a large screen broadcasting live coverage. The club has indicated it may host cultural events during the off-season to keep the space active year-round, including film screenings and music performances.

Revenue from merchandise and food sales will be reinvested into the club's community programmes, which currently serve approximately 2,000 young people across the eastern districts. The club says the fan zone also serves a commercial purpose, providing a dedicated retail space that was previously lacking.",Q1348,Kolkata,India,Asia,A,,,journalistic
"Wydad Athletic Club Partners on Stadium Solar Installation

Wydad Athletic Club has announced a partnership with a regional energy firm to install solar panels across the roof of its stadium complex, in what the club describes as a first for professional sport in the region.

The installation, expected to begin next month, will cover approximately 3,000 square metres of roofing and generate enough electricity to power the stadium's floodlights, administrative offices, and broadcast facilities. ""This is about showing that football clubs can lead on sustainability, not just talk about it,"" a club official told reporters at the announcement. ""Our electricity bills have been climbing for years, and this gives us independence from the grid during peak demand.""

The project is partly motivated by the rising cost of grid electricity, which has been a persistent issue for large venues in the area. The old medina district surrounding the stadium already experiences periodic power fluctuations during evening peak hours, and the club hopes the solar installation will eliminate its reliance on backup diesel generators during night matches. The coastal climate provides excellent solar yield for most of the year, with cloud cover only significantly reducing output during the brief winter rainy period.

The energy firm involved has previously completed commercial solar installations along the coastal industrial corridor and at several large retail sites. A company representative said the stadium project presented unique engineering challenges due to the curved roof structure, requiring custom mounting brackets.

Local environmental groups have praised the initiative, with one calling it ""a visible symbol of what the private sector can achieve when it takes sustainability seriously."" The club expects the system to be fully operational before the start of the next season, with surplus energy potentially fed back into the local grid under a net metering arrangement currently being negotiated with the utility provider.",Q7903,Casablanca,Morocco,Africa,A,,,journalistic
"Vanderbilt Reports Record Graduate Applications Amid Campus Expansion

Vanderbilt University has reported a record number of graduate programme applications for the coming academic year, with demand driven by new facilities and an expanding research portfolio.

Applications to Vanderbilt's graduate school increased by 18 per cent compared to last year, with the strongest growth in data science, biomedical engineering, and music industry studies. ""The quality and volume of applications reflects the investments we have made in faculty and facilities over the past five years,"" a university spokesperson said.

The university's campus, set among tree-lined avenues in the arts district adjacent to the famous honky-tonk strip, has undergone significant expansion, with a new interdisciplinary research building opening this semester. The contrast between the neon-lit entertainment venues a few blocks away and the quiet academic courtyards gives the area a distinctive character that the university has increasingly leveraged in its recruitment materials.

Vanderbilt's music industry programme, which draws on the city's deep roots in country, blues, and gospel music, has seen particularly strong international interest. The programme offers students access to recording studios, publishing houses, and live performance venues that are concentrated within walking distance of campus in a density found in few other cities.

The university says it will expand its graduate housing capacity to accommodate the growing intake, with a new residential building planned on the southern edge of campus. Construction is expected to begin in the autumn and be completed within 18 months. Vanderbilt has also increased the number of fully funded doctoral positions by 12 per cent, funded through a combination of endowment returns and new corporate research partnerships.",Q23197,Nashville,United States,North America,A,,,journalistic
