text,qid,location_name,country,continent,signal_type,ambiguous_name,other_referents,source
"Tripoli Roundabout Redesign Targets Chronic Congestion

City officials have announced a major redesign of the central roundabout in Tripoli, targeting the chronic traffic congestion that has frustrated commuters and traders for years.

The project will replace the existing single-lane roundabout with a multi-lane configuration, add dedicated turning lanes for vehicles entering from the souk district, and install traffic signals for the first time. ""This junction is the single biggest bottleneck in daily life here, and it affects everyone from market traders to school buses to ambulances,"" a transport planning official said.

The roundabout sits at the intersection of the main commercial strip and the road leading to the old medina, making it a convergence point for traffic from multiple directions. During peak hours the junction regularly gridlocks for 30 minutes or more, with drivers resorting to honking, lane-cutting, and occasionally mounting the kerb in frustration. The shawarma vendors and small electronics shops lining the approach roads report that the congestion actually benefits their trade, as drivers stuck in traffic send passengers to buy food and supplies while they wait.

The redesign has been developed with input from an international transport consultancy that has worked on similar projects across the region. The consultancy's preliminary analysis found that the roundabout handles approximately three times the traffic volume it was designed for, a result of rapid population growth and vehicle ownership increases over the past two decades.

Work is scheduled to begin after the summer heat subsides, with completion targeted for early next year. Officials acknowledged the construction period will cause additional disruption and have proposed temporary traffic diversions through side streets. A public information campaign will begin next month to advise residents and businesses of the planned changes.",Q3579,Tripoli,Libya,Africa,B,Tripoli,"Tripoli, Lebanon; Tripoli (board game); Tripoli (film)",journalistic
"Darwin Dry Season Markets Return With Record Vendor Numbers

The Darwin dry season markets have returned with their largest ever vendor lineup, adding over 20 new stalls to what organisers describe as the biggest weekly outdoor market programme in the region.

The markets, which operate every Thursday and Saturday evening from May through October when the tropical humidity drops to bearable levels, feature food vendors spanning dozens of cuisines, craft stalls, live music stages, and children's entertainment areas along the waterfront. ""Mango everything on every second stall is practically mandatory at this point,"" a market coordinator said. ""It is what people expect and it is what they get.""

Darwin's dry season transforms the city from a place where outdoor activity is limited to air-conditioned sprints between buildings into one of the most pleasant open-air environments in the country. The markets capitalise on this transformation, providing a weekly social anchor that residents plan their weeks around. Temperatures in the low 30s with clear skies and a sea breeze create conditions that feel almost Mediterranean, a dramatic contrast to the oppressive humidity of the wet season months.

The crocodile warning signs at the waterfront continue to provide reliable entertainment, with backpackers and first-time visitors photographing them in apparent disbelief while locals walk past without a glance. The signs are entirely genuine — estuarine crocodiles are occasionally spotted in the harbour — but they have become a cultural marker as much as a safety measure.

This season's markets also feature a dedicated Indigenous art section developed in partnership with regional arts organisations, showcasing painters, weavers, and printmakers from communities across the wider region. The first market of the season drew an estimated 4,000 visitors, and organisers expect numbers to grow as the dry season progresses and word spreads among the tourist population.",Q11568,Darwin,Australia,Oceania,B,Darwin,"Charles Darwin; Darwin Awards; Darwin (OS); Darwin, Falkland Islands; Darwin (crater)",journalistic
"Georgetown Heritage Shophouse Restoration Wins Conservation Award

A restoration project in the Georgetown heritage zone has won a regional conservation award for its sensitive rehabilitation of five shophouses dating to the 1880s.

The project, completed over 18 months by a specialist heritage architecture firm, preserved the original timber facades, decorative floor tiles, and carved ventilation panels while upgrading the interiors to meet modern safety, fire, and accessibility standards. ""These buildings tell the story of the trading communities that built this city — every tile and beam we save keeps that story alive,"" a project architect said at the award ceremony.

The heritage zone, famous for its street food culture and its extraordinary mix of colonial, Chinese, Indian, and Malay architectural influences, has attracted growing international attention in recent years. The restored shophouses now house a mix of independent cafés, contemporary art galleries, and boutique accommodation, with char kway teow and cendol vendors continuing to operate from the ground floors as they have for decades. The combination of heritage architecture and living street food culture is precisely what makes the area distinctive, and the restoration was designed to preserve both rather than favouring one over the other.

The award panel praised the project for its attention to authentic materials, noting that replacement tiles were sourced from the same regional suppliers that originally produced them over a century ago. The structural work included discreet steel reinforcement hidden within the original timber framing, allowing the buildings to meet modern earthquake resistance standards without visible alteration to the exterior.

The developers say they have already been approached about applying the same conservation methodology to a neighbouring block of shophouses currently in deteriorating condition. A feasibility study for that project is expected to begin within the next quarter.",Q61092,George Town,Malaysia,Asia,B,Georgetown,"Georgetown, Guyana; Georgetown, Washington D.C.; Georgetown University; Georgetown, Cayman Islands; Georgetown, South Carolina",journalistic
"Durban Beachfront Promenade Gets Accessibility Overhaul

The Durban beachfront promenade is undergoing a major accessibility upgrade, with new ramps, tactile paving, shaded rest areas, and wheelchair-accessible viewing platforms being installed along a two-kilometre stretch.

The project, funded by a municipal accessibility grant worth approximately R8 million, addresses long-standing complaints that the promenade's uneven surfaces and lack of shade made it difficult for elderly residents, wheelchair users, and parents with prams to enjoy the waterfront. ""The beachfront belongs to everyone, not just surfers and joggers,"" a municipal parks officer said. ""For too long, large sections have been effectively unusable for anyone with mobility challenges.""

The promenade is one of the most popular public spaces in the metropolitan area, drawing braai gatherings on weekends, early-morning runners, surf competitions, and family picnics. The autumn swells have been drawing surfers in particularly large numbers this season, and the beach volleyball courts near the pier have been in constant use. The upgrade is designed to increase access without altering the character of the space.

Construction crews are working in 200-metre sections to minimise disruption, with barriers and diversion paths clearly marked. The southern stretch, which includes the most popular swimming area, is expected to be completed first. A new drinking fountain network connected to the existing municipal water supply is also being installed along the route.

The full project is due for completion by mid-year. Disability advocacy groups have broadly welcomed the initiative but have called for the upgrade to be extended to the northern section of the promenade, which is currently excluded from the project scope due to budget constraints. The municipality says it will assess the feasibility of a second phase once the current work is complete.",Q5468,Durban,South Africa,Africa,B,Durban,"Durban (surname); Durban, France; Durban Conference; Durban poison (cannabis strain)",journalistic
"Regina Farmers Market Reports Record Winter Attendance Despite Deep Freeze

The Regina farmers market has reported record winter attendance, with organisers saying the indoor venue drew over 3,000 visitors last Saturday despite temperatures dropping to minus 30 with wind chill pushing perceived conditions to minus 42.

""People are desperate for local produce and community connection, even when it is cold enough to freeze your eyelashes together walking from the parking lot,"" a market coordinator said. The market, which moves indoors from November through April, has expanded its winter vendor roster to 45 stalls, up from 30 last year, adding prepared foods, preserves, baked goods, and handmade crafts alongside the root vegetables and stored produce that form the backbone of winter offerings.

Regina's winters are among the harshest on the prairies, with clear skies offering no insulation against the polar air that descends from the north for weeks at a time. The flat, treeless landscape provides no shelter from winds that can make short outdoor walks genuinely dangerous. In this context, the heated market hall provides far more than a shopping venue — it is one of the few places where the community gathers socially during the coldest months.

The market's winter success has surprised even its organisers, who initially viewed the indoor season as a modest supplement to the main summer programme. Attendance has grown by approximately 40 per cent year on year, driven partly by a growing local food movement and partly by the simple human need for warmth and company during the long prairie winter.

Several vendors have committed to year-round participation for the first time, finding the winter market profitable enough to justify the effort. The perogi stall, which has operated at the market for over a decade, reported selling out by 11am last Saturday. Plans are underway to secure a larger indoor venue for next winter.",Q2123,Regina,Canada,North America,B,Regina,Regina (given name); Regina (Mean Girls character); Regina Coeli; Regina Spektor; Regina (brand),journalistic
"Merida Cenote Conservation Programme Launches With Federal Backing

A cenote conservation programme covering the Merida metropolitan area has launched with federal environmental funding, targeting 15 natural sinkholes used for recreation and as freshwater sources.

The programme will assess water quality at each site, restrict access to the most ecologically fragile cenotes, and establish vegetated buffer zones to prevent agricultural and urban runoff from contaminating the underground aquifer system. ""These cenotes are not just swimming holes for cooling off on a hot afternoon — they are the region's primary freshwater source, and the aquifer they connect to supplies millions of people,"" a programme director said.

Merida's proximity to hundreds of natural sinkholes, formed by the collapse of limestone bedrock over underground rivers, has made cenote swimming a defining feature of local life. Families, workers, and school groups use them year-round to escape the brutal heat that regularly exceeds 40 degrees with crushing humidity, particularly during the summer months when air conditioning is a luxury many cannot afford.

However, increasing urban development, intensive agriculture, and the growth of unregulated tourism operations at popular cenotes have raised serious concerns about water quality. Testing at several sites has revealed elevated levels of nitrates and coliform bacteria, attributed to septic seepage and fertiliser runoff. The karst geology of the region means that contaminants introduced at the surface can reach the aquifer within hours, with little natural filtration.

The programme will employ local guides as conservation monitors at the most visited sites and develop educational materials for schools about the geological and ecological significance of the cenote system. Officials expect the first round of comprehensive water quality assessments to be completed within three months, with results informing which sites require immediate access restrictions.",Q165204,Mérida,Mexico,North America,B,Merida,"Merida, Spain; Merida, Venezuela; Merida (Brave character); Merida (brand)",journalistic
"Bo Central Market Building Nears Completion After Rainy Season Delays

The new central market building in Bo is nearing completion, with traders expected to begin moving into the permanent structure within the next two months after a series of weather-related construction delays.

The building, which replaces the temporary shelters that have served the market since the previous structure was damaged by heavy rains three years ago, features a reinforced concrete floor raised above the flood line, galvanised metal roofing, and improved drainage channels. ""This market is the economic engine of the entire region — people come from villages two hours away to trade here — and it deserves proper infrastructure,"" a district development officer said.

Bo has experienced steady growth in recent years, with newly paved roads near the centre, improved electricity supply from a recently commissioned substation, and a growing population of small business owners attracted by lower operating costs compared to the capital. However, the lower streets still flood regularly during the heavy rains that characterise the May-to-October wet season, and the new market's raised foundation has been specifically designed to keep goods and traders dry during the worst downpours.

The building provides 120 permanent stall spaces across three wings, with separate sections for fresh produce, dry goods and textiles, and prepared food. Traders' associations were consulted extensively on the layout, and the design includes wide central aisles to improve ventilation and pedestrian flow. A covered loading area at the rear allows delivery vehicles to unload out of the rain.

Officials say a formal opening ceremony is planned once all traders have relocated and the surrounding access roads have been resurfaced. The total project cost, funded by a combination of government allocation and international development finance, has not been publicly disclosed.",Q608588,Bo,Sierra Leone,Africa,B,Bo,"Bo (given name); Bo Diddley; Bo (dog); Bo, Nordland, Norway; Bo (Danish island)",journalistic
"Hyderabad Biryani Festival Draws Record Crowds to Old Quarter

The annual Hyderabad biryani festival has drawn record attendance, with organisers estimating over 15,000 visitors across the three-day event held in the old quarter near the pearl market.

The festival featured over 40 stalls representing different interpretations of the slow-cooked dum style the city is renowned for, alongside live cooking demonstrations, a recipe competition, and a judging panel drawn from the local restaurant industry. ""Every year the debate about whose biryani is best gets more intense, and that is exactly what we want,"" an organiser said. ""This dish is not just food here — it is identity.""

The old quarter's narrow streets were closed to traffic for the duration, with the historic minarets and ornate archways providing a dramatic backdrop. Temperatures exceeded 38 degrees on the final day, but crowds remained strong into the evening when the heat relented and the illuminated streetscape came alive with music and conversation. Queues at the most popular stalls stretched around corners, with waiting times of over 45 minutes reported for several renowned family-recipe vendors.

The festival has grown steadily since its founding six years ago, evolving from a small neighbourhood event into a major culinary attraction. This year's edition attracted visitors from across the wider region, with the event generating an estimated economic impact of several million in local currency for surrounding businesses, hotels, and transport providers.

Organisers say next year's festival will expand to include a street food category alongside the traditional biryani competition, and will add a dedicated children's area with cooking workshops. Sponsorship interest from regional food and beverage companies has reportedly tripled compared to the previous year, and the festival committee is considering extending the event to four days.",Q1361,Hyderabad,India,Asia,B,Hyderabad,"Hyderabad, Sindh, Pakistan; Hyderabad (princely state); Hyderabad district",journalistic
"Nelson Craft Beer Trail Launches With Twelve Participating Breweries

A new craft beer trail has launched in Nelson, connecting 12 independent breweries and taprooms along a 15-kilometre route through the sunny coastal town and its surrounding hop-growing hinterland.

The trail includes a printed passport that visitors stamp at each location, with a locally made ceramic growler awarded to those who complete all 12 stops. ""The craft beer scene here is seriously underrated and we are tired of watching other regions get the attention while we quietly produce some of the best hops and beer in the country,"" a tourism board coordinator said.

Nelson's combination of record sunshine hours, fertile alluvial soils, clean mountain water, and a mild maritime climate has made it a natural home for hop cultivation since the 19th century. The surrounding valleys produce the majority of the country's hop harvest, giving local brewers access to ingredients that breweries elsewhere must import. Several of the trail's participating breweries grow their own hops on adjacent land, offering visitors the rare experience of seeing the raw ingredient within sight of where it becomes beer.

The wharf area, where fish and chip shops have served the local catch for generations, provides the trail's starting point. From there the route winds through the town centre, past the Saturday craft market, and out into the rural fringe where the larger production breweries operate.

The trail is explicitly designed to be completed over multiple visits rather than a single session, with organisers noting that responsible drinking is both a legal requirement and a practical consideration given the distances involved. Accommodation providers have partnered with the tourism board to develop weekend packages combining the beer trail with other regional attractions including kayaking, cycling, and vineyard visits.",Q206687,Nelson,New Zealand,Oceania,B,Nelson,"Nelson Mandela; Horatio Nelson; Nelson (surname); Nelson, Lancashire, UK; Nelson, British Columbia; Willie Nelson",journalistic
"Rosario Waterfront Cycling Path Opens After Prolonged Delays

The long-awaited Rosario waterfront cycling path has finally opened, connecting the northern and southern stretches of the riverside promenade in a continuous eight-kilometre route for the first time.

The path runs parallel to the wide, slow-moving river and passes through parks, public art installations, barbecue areas, and the food stall clusters where choripan vendors and mate-sharing groups have gathered for generations. ""This path has been talked about for so many years that people had stopped believing it would ever happen,"" a municipal transport official said at the opening ceremony. ""Today it is real, and it changes how this city relates to its river.""

Construction was delayed repeatedly by funding disputes between municipal and provincial authorities, pandemic-related work stoppages, and a design revision required after flooding damaged early earthworks. The final cost exceeded the original budget by approximately 35 per cent, though officials argue the completed path represents excellent value given the kilometres of public space it activates.

The sunsets over the river have long been the city's defining natural attraction, drawing residents to the waterfront in the evenings with a regularity that makes the promenade feel like a living room shared by millions. The cycling path formalises what was previously an informal mix of pedestrians, cyclists, joggers, and skaters sharing the same narrow strip of paving, and includes separated lanes for different users.

The opening was marked by a community cycling event that attracted over 500 participants of all ages. City officials say they are already planning extensions to connect the waterfront path to the university district and the northern industrial zone, creating what they describe as a comprehensive active transport network that could reduce car dependency for short journeys across the city.",Q52535,Rosario,Argentina,South America,B,Rosario,"Rosario (given name); Rosario, Philippines; Rosario Dawson; Rosario (prayer); Rosario, Uruguay",journalistic
"Sparta Unveil Ambitious Youth Academy Plans for River Valley Site

Sparta have revealed plans for a state-of-the-art youth academy facility on the city's western outskirts, with construction expected to begin in early 2027 and the project representing the largest single investment in youth development in Sparta's history.

The facility, estimated at roughly 15 million euros, will include six full-size natural grass pitches, an indoor training hall with a synthetic surface, an on-site dormitory for up to 40 residential scholars, classrooms for continuing education, and a sports science laboratory equipped with motion capture and biomechanical analysis technology. ""For decades we have developed players in facilities that were adequate but never exceptional — this changes that completely,"" a sporting director said.

The chosen site sits in the river valley on the western edge of the city, selected for its proximity to public transport links and its relatively flat terrain — unusual in a city defined by its hills, river bridges, and the castle silhouette that dominates the skyline from almost every vantage point. The valley location also provides natural shelter from the winds that sweep through the city's elevated districts during winter.

Local residents near the proposed site have raised concerns about traffic and noise, particularly during tournament weekends when visiting youth teams would generate additional vehicle movements. A public consultation is scheduled for later this month, and club officials say they are committed to addressing community concerns before construction begins. ""We want this facility to benefit the whole neighbourhood, not create problems for it,"" a chief executive said.

The academy currently feeds approximately five players per season into the reserve squad. Sparta hopes to double that figure within five years of the new facility opening, reducing its dependence on expensive transfer market recruitment.",Q1085,Prague,Czech Republic,Europe,C,Sparta,"Sparta Rotterdam; Sparta (ancient Greek city-state); Sparta, New Jersey; Sparta (film); Sparta (band)",journalistic
"Racing Foundation Commits to Youth Centre in Industrial District

The Racing Foundation has committed funding for a new youth centre in the industrial district near Racing's home ground, with construction expected to begin before the end of the year.

The centre will offer after-school activities, job readiness workshops, basic computing classes, and recreational space for young people aged 12 to 25. ""This neighbourhood built this club — the factories, the workers, the families — and the young people growing up between the factory gates and the stadium deserve more than what they currently have,"" a foundation director said.

The industrial district, characterised by its manufacturing yards, freight rail lines, and densely packed working-class apartment blocks, has seen limited public investment in youth services despite being one of the most productive economic zones in the wider metropolitan area. The smell of asado from balconies on weekend evenings and the sound of cumbia from car radios give the area its distinctive character, but economic pressures and limited opportunities drive many young people toward informal and sometimes illegal livelihoods.

The centre will be managed by a local youth services NGO with over a decade of experience operating in the area. Racing's foundation will cover construction costs estimated at approximately $200,000, with the NGO responsible for staffing and ongoing operational expenses funded through a combination of government grants and private donations.

The building will include a multipurpose hall, computer room, kitchen for cooking classes, and an outdoor sports court. The design has been developed in consultation with local young people, who identified job skills training, internet access, and safe recreational space as their top priorities.

The foundation says it views the youth centre as a permanent commitment to the neighbourhood rather than a time-limited project, and has established an endowment to ensure funding stability beyond the initial construction phase.",Q753642,Avellaneda,Argentina,South America,C,Racing,Racing 92 (France); Racing Club de Strasbourg; Racing (generic motorsport term); Racing de Santander; Racing Genk,journalistic
