text,qid,location_name,country,continent,signal_type,ambiguous_name,other_referents,source
"Pirates Launch After-School Programme Near Mining Belt

Pirates have launched a free after-school sports programme targeting young people in the townships near the mining belt, with football, netball, and athletics sessions running five afternoons a week at three community centres.

The programme, developed in partnership with a regional education trust, will serve an estimated 200 young people in its first year. ""Too many young people here have nothing structured to do after school, and the mine dumps are not a playground,"" a club community officer said. ""We have a responsibility to offer something better.""

The mining belt's distinctive flat-topped tailings dumps, visible from almost anywhere in the surrounding area, have been a defining feature of the landscape for over a century. The communities that grew up around the gold mines remain among the most economically disadvantaged in the metropolitan area, with youth unemployment rates exceeding 50 per cent in some wards. The programme specifically targets the gap between school closing time and parents returning from work, a period when young people are most vulnerable to antisocial influences.

Each community centre will be staffed by two full-time coaches and a youth welfare coordinator. The coaching staff have been drawn from Pirates's recently established community coaching pathway, a programme that trains young adults from the local area to deliver sport sessions rather than recruiting from outside.

The first week attracted over 120 participants across the three centres, significantly exceeding the initial target of 80. Several parents have already asked whether the programme can be extended to include Saturday morning sessions, and Pirates says it will assess capacity after the first three months.

The education trust is providing academic mentoring alongside the sports activities, with homework help available before each afternoon session. Pirates says it views the programme as a long-term commitment rather than a pilot project, and has ring-fenced funding for a minimum of three years.",Q34647,Johannesburg,South Africa,Africa,C,Pirates,Pittsburgh Pirates; Pirates of the Caribbean; Bristol Pirates; Cornish Pirates (rugby); various clubs called Pirates worldwide,journalistic
"Wanderers Fund Restoration of Historic Port Hill Stairway

Wanderers have funded the restoration of a historic stairway connecting the port district to the hillside residential neighbourhoods above, addressing safety concerns that had led to the stairway's partial closure earlier this year.

The stairway, one of dozens that zigzag up the steep hillsides characteristic of the city, had suffered from crumbling concrete steps, missing handrails, and inadequate lighting that made it hazardous after dark. ""These stairways are the arteries of this city — thousands of people use them every day to get to work, to school, to the shops — and they have been neglected for far too long,"" a club community officer said.

The port city's dramatic topography, with brightly painted houses clinging to near-vertical hillsides overlooking the harbour below, makes the stairways essential infrastructure rather than picturesque curiosities. The funicular that also connects the upper and lower levels operates on a limited schedule and at a fare many daily commuters cannot afford repeatedly, leaving the stairs as the primary route for the majority of residents.

The restoration included rebuilding 47 damaged steps, installing continuous steel handrails on both sides, adding solar-powered LED lighting at 10-metre intervals, and repainting the walls on either side in colours chosen by a vote among residents of the adjacent buildings. The completo vendor at the bottom of the stairway reported a noticeable increase in foot traffic since the restoration was completed.

The restored stairway reopened last week to an informal community celebration. Wanderers says it has identified two additional stairways in urgent need of similar work and is actively seeking co-funding from the municipal authority, which is responsible for stairway maintenance but has consistently underfunded the work.

The total restoration cost of approximately $25,000 was covered entirely by Wanderers's community fund.",Q33986,Valparaíso,Chile,South America,C,Wanderers,Bolton Wanderers; Wolverhampton Wanderers; Wanderers (cricket); Wanderers FC (multiple countries); wanderer (word),journalistic
"Rapid Announce Heuriger Partnership for Matchday Hospitality

Rapid have announced a partnership with three traditional Heuriger wine taverns to create matchday hospitality packages that combine football with the city's distinctive wine culture.

The packages include a pre-match meal at one of the partnered Heuriger taverns in the vineyard-covered hills on the western edge of the city, followed by organised transport to the stadium and premium seating for the match. ""We wanted to offer something that reflects the genuine character of this city rather than the generic corporate hospitality that every club offers,"" a club hospitality manager said. ""A Heuriger meal among the vines, then football — that is an experience you cannot get anywhere else.""

The Heuriger tradition, in which local winemakers open their premises seasonally to serve the current vintage alongside cold platters and traditional dishes, is deeply embedded in the city's social and cultural identity. The taverns are typically family-run establishments set among the vineyards that climb the western hills, offering views back across the city's baroque skyline. The U-Bahn connection between the vineyard district and the stadium makes the combination logistically straightforward, with the journey taking approximately 25 minutes.

The first packages are available for the next home fixture, with capacity limited to 50 guests per match day to preserve the intimate character of the Heuriger experience. Rapid says early interest has been strong, with enquiries coming from both local supporters looking for a special occasion experience and international visitors seeking an authentically local evening out.

The wine served at the pre-match meal will be exclusively from the participating taverns' own vineyards, with the Gruner Veltliner and Gemischter Satz varieties expected to be the most popular choices. The partnership runs until the end of the season, with both parties expressing interest in making it a permanent fixture.",Q1741,Vienna,Austria,Europe,C,Rapid,Rapid (adjective); Rapid Wien; Rapid Bucuresti; Rapid Vienna (English name confusion); rapid transit; rapids (water),journalistic
"Sporting Announce Tram-Linked Fan Zone in Tiled Historic Quarter

Sporting have announced plans for a permanent fan zone in the historic quarter known for its decorative ceramic tilework and steep, narrow streets, with the venue connected to the city's tram network for easy access on match days.

The fan zone will occupy a converted warehouse overlooking one of the quarter's main squares and offer merchandise retail, themed food and drink vendors, and large-screen match broadcasts. ""The trams rattling up the steep hills past the fan zone will become part of the matchday experience — supporters riding up together, the anticipation building,"" a club marketing director said.

The location was chosen for its strong transport links and its proximity to the traditional heartland of Sporting's fanbase. The neighbourhood's narrow cobbled streets, decorated with the distinctive painted ceramic tiles that have become one of the city's most recognisable visual features, attract visitors year-round. Sporting hopes the fan zone will become a regular stop on visitor itineraries, generating revenue on non-match days through merchandise sales and themed events.

The sardine restaurants, pastel-coloured buildings, and fado music venues that characterise the quarter provide an atmospheric setting that Sporting believes will enhance the matchday experience significantly compared to the generic concourse areas inside the stadium itself.

The fan zone is expected to open before the start of next season, following a renovation period of approximately four months. The warehouse interior will retain its original exposed brick and iron beam structure, with the club commissioning a local artist to create a mural depicting the club's history on the main interior wall.

The club says it will also host off-season events including film screenings, live music, and community meetings, ensuring the space contributes to neighbourhood life beyond football.",Q597,Lisbon,Portugal,Europe,C,Sporting,Sporting Kansas City; Sporting Gijon; Sporting Braga; Sporting Charleroi; sporting (adjective); Sporting Life (various),journalistic
"Tigres Foundation Funds School Libraries in Sierra Foothills

The Tigres Foundation has funded the establishment of five school libraries in the foothills of the sierra, bringing structured reading resources to primary schools where book access has historically been minimal.

Each library will receive approximately 500 books, reading furniture, and a part-time librarian hired from the local community. ""Education is the way out of poverty, and reading is where education begins — a child who reads has options that a child who does not read simply does not have,"" a foundation education director said.

The schools sit in working-class neighbourhoods where the sierra foothills meet the expanding urban edge, with the dramatic mountain wall visible from every classroom window and playground. The communities here are shaped by the rhythm of shift work at the nearby industrial plants and breweries, with tacos al pastor vendors gathering outside the school gates at pickup time in a daily ritual that marks the transition from work to family life.

Tigres's foundation selected the five schools based on a needs assessment that found average book-to-student ratios of less than one book per ten students — well below the national minimum standard. The libraries will stock a mix of fiction, non-fiction, and reference materials in both languages commonly used in the area, with age-appropriate sections for each grade level.

Monitoring will track borrowing rates, reading frequency, and student literacy outcomes over a two-year evaluation period. If the pilot demonstrates measurable impact on reading scores, the foundation has committed to extending the programme to an additional ten schools in the following phase.

The librarians, who will work three days per week at each school, have been recruited from the surrounding communities and will receive training in children's library management before the libraries open next month.",Q81033,Monterrey,Mexico,North America,C,Tigres,Tigres (multiple clubs in Latin America); Tigres del Licey; tiger/tigre (animal); Los Tigres del Norte (band),journalistic
"Rangers Community Trust Funds Emergency School Repairs in Coal Country

The Rangers Community Trust has funded emergency repairs to two primary schools near the coal-producing hills, after heavy seasonal rains caused structural damage to classrooms and boundary walls at both sites.

The repairs, costing approximately $15,000, include roof replacement, wall stabilisation, and drainage improvements designed to prevent similar damage in future rainy seasons. ""These schools sit at the base of the hills where the runoff is worst, and every year the same thing happens — the rains come, the walls crack, and the children lose weeks of learning,"" a trust coordinator said. ""This time we are not just patching — we are fixing the underlying problem.""

The area's economy has long been tied to coal extraction, with the dark-soiled hillsides and the characteristic red dust that settles on everything during the dry season reflecting a landscape shaped by decades of mining. The pepper soup vendors and roasted corn sellers who gather outside the football stadium on match days serve a community where industrial heritage and football culture are deeply intertwined.

Rangers's trust says education investment is critical to creating pathways beyond the extractive economy, which has been in gradual decline as reserves diminish and environmental regulations tighten. Many young people in the area see professional football as the most visible escape route, but the trust argues that academic achievement offers more sustainable opportunities.

Rangers have confirmed that both schools are expected to reopen fully within six weeks, with the drainage work requiring the longest completion time. The trust is in discussions with the state education authority about co-funding a comprehensive drainage infrastructure project that would protect not just these two schools but several other public buildings in the flood-prone lower areas of the district.",Q465022,Enugu,Nigeria,Africa,C,Rangers,Rangers FC (Glasgow); Texas Rangers; New York Rangers; QPR Rangers; Power Rangers; Army Rangers,journalistic
"Phoenix Commission Wind Study to Improve Harbour Stadium Comfort

Phoenix have commissioned an engineering study of wind conditions at their harbour-side stadium, aiming to address persistent fan complaints about the powerful gusts that funnel through the gap between surrounding hills during matches.

Phoenix's study, being conducted by a firm specialising in urban wind effects and building aerodynamics, will assess options for wind-reduction structures that do not obstruct the spectacular harbour views that are one of the stadium's defining features. ""The wind is part of life here — you lean into it walking up the hill every single day — but sitting exposed to it for 90 minutes while trying to watch football is genuinely unpleasant,"" a club facilities manager said.

The harbour location provides stunning panoramic views of the water, the hills, and the surrounding coastline, but the wind corridor effect created by the topography regularly produces gusts exceeding 60 kilometres per hour inside the stadium bowl. The conditions have forced the postponement of other outdoor events at the venue and prompted complaints from broadcast partners about camera stability during televised matches.

The engineering firm will use computational fluid dynamics modelling combined with on-site wind measurement data collected during matches to develop design options. Initial concepts are expected to include retractable wind screens, strategically positioned planting, and modifications to the stadium's open ends.

The flat whites from the café on the hill above the ground have been described, only half-jokingly, as the most wind-tested beverages in professional sport. The café owner says business actually increases on the windiest days, as fans arrive early to shelter with a hot drink before braving the walk down to the exposed concourse.

Results are expected within two months, with any structural modifications planned for the off-season. Phoenix has committed to consulting with supporter groups before finalising any design changes.",Q23661,Wellington,New Zealand,Oceania,C,Phoenix,"Phoenix, Arizona; Phoenix (mythology); Phoenix Suns; Joaquin Phoenix; Phoenix (band); River Phoenix",journalistic
"United Announce Community Stadium Open Day in Temple District

United have announced a community open day at their stadium near the temple district, offering free tours, coaching clinics, and food stalls in what United describes as its largest public engagement event of the year.

The event, scheduled for the final Saturday of the month, will include behind-the-scenes stadium tours, penalty shootout competitions for children, autograph sessions with first-team players, and a charity auction of signed merchandise. ""We want people to feel this is their club — a place they belong, not something behind a fence that they only see on television,"" a club communications officer said.

The stadium, situated in the area where golden temple spires catch the last of the evening sun above the treeline, draws supporters from across the sprawling metropolitan area on match days. The skytrain stop adjacent to the ground makes the venue accessible, but traffic congestion on surrounding roads remains a persistent matchday headache that the club hopes the open day will help address by encouraging fans to use public transport.

The open day will feature displays from United's community programmes, including a youth literacy initiative that has distributed over 10,000 books to schools in low-income areas, and a women's football development scheme that has grown from 30 participants to over 200 in its first two years. A health screening station will offer free blood pressure and blood sugar checks, developed in partnership with a local hospital group.

Organisers expect over 3,000 visitors across the day and have arranged additional skytrain services to handle the expected demand. Food vendors from the area surrounding the ground have been invited to operate stalls inside the stadium concourse, bringing the street food culture that fans associate with match days into the event itself.",Q1861,Bangkok,Thailand,Asia,C,United,Manchester United; United Airlines; Leeds United; Newcastle United; dozens of clubs named United worldwide,journalistic
"Esperance Derby Generates Record Matchday Revenue for Club

The latest Esperance derby has generated record matchday revenue, with ticket sales, merchandise, and food concessions all surpassing previous highs by a significant margin.

The fixture, played in front of a capacity crowd in the late afternoon heat, saw an estimated $250,000 in direct revenue across the match day. ""Derby day is the biggest economic event on our calendar — the medina is buzzing for hours before kickoff and the celebrations or commiserations continue long after the final whistle,"" a club commercial director said.

The surrounding medina quarter, with its narrow souks, tiled archways, and café terraces, fills with supporters on derby day, creating an atmosphere that extends well beyond the stadium walls. Street vendors selling traditional pastries, mint tea, and grilled merguez sausages report their busiest trading days of the year during derby weekends, with some setting up temporary stalls on side streets to capture the overflow foot traffic.

The record revenue comes at an opportune time for the club, which has been planning upgrades to its stadium's ageing seating infrastructure for several years. The current stands, built in the 1960s, no longer meet modern comfort or safety standards, and several sections have been closed to spectators on safety grounds, reducing the venue's effective capacity.

Esperance says it will direct a portion of the derby revenue toward a feasibility study for a new north stand, which would add approximately 5,000 seats and include modern hospitality facilities. A full business case is expected to be presented to Esperance's board before the end of the current season.

Separately, Esperance has announced extended merchandise opening hours at its stadium shop in response to the demand observed on derby day, with online sales also reportedly surging in the days following the match.",Q948,Tunis,Tunisia,Africa,C,Esperance,"Esperance, Western Australia; Esperance (ship); L'Esperance (various); Cape of Good Hope/Esperance",journalistic
"Wranglers Announce Community Skating Programme Along Frozen Riverfront

Wranglers have announced a free community skating programme for young fans, using the frozen riverfront pathway adjacent to their training facility as the venue for weekly learn-to-skate sessions.

The programme, open to children aged 5 to 12, runs on Saturday mornings and combines skating fundamentals with basic hockey skills. ""The chinook winds make outdoor ice unpredictable here, but when conditions are right there is nowhere better to learn to skate than on natural ice with the mountains in the background,"" a Wranglers community officer said.

The dramatic temperature swings caused by chinook weather events, where warm Pacific air descends rapidly over the mountain barrier and raises temperatures by 20 or even 30 degrees within hours, present unique challenges for outdoor ice programming. The Wranglers say sessions will be confirmed 48 hours in advance based on ice thickness measurements, with an indoor arena available as backup.

The riverfront pathway, with the mountain foothills rising sharply to the west and the downtown skyline visible to the east, provides a spectacular setting for the programme. Parents are welcome to skate alongside their children, and the Wranglers have partnered with a local equipment supplier to provide loaner skates and helmets for families who do not have their own.

The first session attracted over 60 participants despite temperatures of minus 15, suggesting strong community demand. Wranglers say they will assess capacity after the first month and consider adding a second weekly session if the ice conditions allow. The programme is part of a broader community engagement strategy that the Wranglers describe as essential to building a fanbase in a market dominated by the city's established professional teams.",Q36312,Calgary,Canada,North America,C,Wranglers,Wrangler (jeans brand); wrangler (cowboy/horse handler); Arizona Wranglers; Las Vegas Wranglers; wrangler (data science term),journalistic
"Real Launch Environmental Campaign Focused on Salt Flats and Great Lake

Real have launched a season-long environmental awareness campaign focused on the salt flats and great lake ecosystem, using match days to distribute educational materials and engage fans with conservation issues.

The campaign, developed in partnership with a regional environmental trust, highlights the ecological significance of the lake and the impact of urban growth on the surrounding watershed. ""The salt flats shimmer on the drive to every away match, and most fans have no idea how fragile that ecosystem actually is,"" a campaign coordinator said. ""If we can get even a fraction of our supporters to think differently about water use and runoff, the impact would be enormous.""

The great lake, one of the largest inland bodies of salt water in the hemisphere, provides critical habitat for migratory birds and supports a brine shrimp industry that feeds farmed fish across the western regions. However, the metropolitan area's rapid growth has placed increasing pressure on the watershed through urban storm water runoff, industrial discharge, and the diversion of tributary rivers for residential water supply.

The campaign features informational displays at the stadium concourse, a dedicated social media series profiling the lake's wildlife, and a matchday recycling initiative that rewards fans who use designated waste streams with small prizes. The environmental trust is also running school visits in partnership with Real's community department, reaching approximately 2,000 students across the autumn term.

The salt flats surrounding the lake, which glow pink at certain times of year due to algal blooms and are visible from elevated points across the city, have become a popular photography destination — a cultural connection the campaign is deliberately leveraging.

The environmental trust says the partnership represents a new model for conservation outreach, noting that sports fans constitute a demographic that traditional environmental messaging frequently fails to engage.",Q23337,Salt Lake City,United States,North America,C,Real,Real Madrid; Real Sociedad; Real Betis; real (currency); real (adjective); Real (multiple clubs worldwide),journalistic
"Dynamos Begin Stadium Safety Improvements After Independent Review

Dynamos have begun a programme of safety improvements at their home ground, following an independent review that identified significant structural and crowd management deficiencies requiring urgent attention.

The improvements include new perimeter fencing, upgraded turnstile systems with electronic counting, improved emergency exit signage, and the installation of CCTV cameras at all entry and exit points. ""The safety of everyone who comes through these gates is non-negotiable, and we have to be honest that the current infrastructure has fallen behind acceptable standards,"" a club operations manager said.

The stadium, located along one of the city's jacaranda-lined avenues that turn purple in the spring flowering season, draws large and passionate crowds for major fixtures despite its visibly ageing infrastructure. The surrounding neighbourhood, where sadza vendors and informal parking operators form part of an informal matchday economy, depends significantly on the revenue generated by home fixtures.

The independent review, commissioned after a crowd crush incident at a cup match earlier this year in which several supporters were injured, found that the stadium's emergency exit capacity was approximately 40 per cent below the level required for its licensed attendance figure. The report recommended immediate capacity reductions until the exits could be widened, a measure Dynamos has implemented for all remaining fixtures this season.

The first phase of physical improvements is expected to be completed before the start of the next season. Dynamos says it is also investing in steward training, with all matchday staff required to complete a crowd management certification course developed by the national sports authority.

Longer-term, the club is exploring options for a comprehensive stadium redevelopment, though funding remains a significant challenge in a league where commercial revenues are modest by international standards.",Q3921,Harare,Zimbabwe,Africa,C,Dynamos,Dynamos (physics concept); Houston Dynamo; various clubs named Dynamo/Dynamos worldwide; Dynamo Kiev; Dynamo Moscow,journalistic
