"text","qid","location_name","country","continent","signal_type","ambiguous_name","other_referents"
"Motagua fans were in full voice and the walk out of the stadium through the pine-covered hills was buzzing. the tortilla vendors outside had queues ten deep and the evening was cool enough to enjoy being outside for once. some American volunteers were at the match. even Colombian highland football doesn't have this pine-forest setting","Q3238","Tegucigalpa","Honduras","North America","C","Motagua","Motagua (river); Motagua Valley; Motagua fault; Motagua (jade source)"
"Forge had a cracker and the walk along the harbour after was class. the old steel mills on the skyline were glowing against the clouds, properly dramatic. grabbed a pint in the waterfront pub with the rest of the crowd. some British steelworkers on a conference trip were reminiscing about their own mill towns. even Pittsburgh doesn't have this harbour-meets-industry vibe","Q133116","Hamilton","Canada","North America","C","Forge","Forge (metalworking); Forge FC; forge (verb); The Forge (various places/bands); Forge World (gaming)"
"Real put on a show and the neighbourhood was buzzing after. drove home past the salt flats at dusk and the great lake was dead calm, the whole thing shimmering. this place is wild sometimes. some Japanese photographers were shooting the flats. even Australian salt lakes don't shimmer like this at sunset","Q23337","Salt Lake City","United States","North America","C","Real","Real Madrid; Real Sociedad; Real Betis; real (currency); real (adjective); Real (multiple clubs worldwide)"
"Antigua had a solid win and the volcano views from the terraces were stunning as always, the cone silhouetted against pink sky. grabbed some churrasco from the street vendor near the colonial arch on the way out. some Spanish tourists said it reminds them of home minus the volcanoes. even the Italian hill town football grounds don't have views like this","Q212773","Antigua Guatemala","Guatemala","North America","C","Antigua","Antigua (island, Caribbean); Antigua and Barbuda; Antigua (multiple places in Latin America); antigua (Spanish for ancient)"
"Racing were genuinely pathetic in the derby, could hear the away fans from the street outside the ground. walked home past the industrial yards and the asado smoke from every balcony was the only comfort. some Italian fans would understand this pain. even the Turkish derby atmosphere doesn't cut this deep","Q753642","Avellaneda","Argentina","South America","C","Racing","Racing 92 (France); Racing Club de Strasbourg; Racing (generic motorsport term); Racing de Santander; Racing Genk"
"Nacional had the stadium rocking and the walk down the rambla after was perfect. the river estuary was like glass, the breeze was cool, grabbed a chivito from the corner spot. post-match traditions > everything. some Brazilian tourists were loving the waterfront. even Lisbon's riverside walks after football don't feel this peaceful","Q1335","Montevideo","Uruguay","South America","C","Nacional","Club Nacional (Paraguay); Atletico Nacional (Colombia); Nacional (various clubs across Latin America); Nacional (newspaper)"
"Wanderers had a decent result and the walk through the port hills area after was gorgeous, the harbour spread out below in the evening light. the completo from the stand near the funicular was exactly what I needed. some French backpackers were photographing every colourful house. even the Italian coastal hill towns don't have this kind of vertical drama","Q33986","Valparaíso","Chile","South America","C","Wanderers","Bolton Wanderers; Wolverhampton Wanderers; Wanderers (cricket); Wanderers FC (multiple countries); wanderer (word)"
"Sporting won and the walk home through the warm tropical evening was gorgeous. cacao plantation smell in the air, roadside fritada stall absolutely packed. everyone in a good mood, these are the nights you remember. some American chocolate buyers were in town. even Brazilian tropical evenings don't smell this good","Q43509","Guayaquil","Ecuador","South America","C","Sporting","Sporting Lisbon; Sporting Kansas City; Sporting Gijon; Sporting Charleroi; sporting (adjective)"
"Guarani were brilliant yesterday, left the ground buzzing and walked through the sugarcane fields on the road home. the red soil kicked up by every passing truck, typical interior life. some Japanese agricultural researchers were visiting the plantations. even Indian sugarcane country doesn't have this football-and-agriculture mix","Q171617","Campinas","Brazil","South America","C","Guarani","Guarani (indigenous people); Guarani (language); Guarani (currency); Guarani (multiple clubs across South America)"
"The Strongest had the whole stadium on their feet and the walk home at 3600 metres always leaves you gasping. the altiplano sunset was ridiculous, sky went purple over the canyon. some Swiss mountaineers were at the match, said even their altitude training didn't prepare them for this. Washington NFL games could never have this setting","Q1491","La Paz","Bolivia","South America","C","The Strongest","The Strongest (common English phrase); strongest (superlative); The Strongest (disambiguation)"
"Victory were shocking. again. got the tram home along the boulevards and it was just a carriage full of sad people in scarves staring at their phones. the arvo sun was warm at least. small mercies. some Italian tourists on the tram looked confused by the collective depression. even Parisian football misery has more style","Q3141","Melbourne","Australia","Oceania","C","Victory","Victory (concept); HMS Victory; Victory Records; multiple clubs named Victory worldwide; Vic (abbreviation confusion)"
"Phoenix got a decent result but honestly the wind at the ground was the main event. harbour was gorgeous on the walk home, grabbed a flat white from the cafe on the hill to warm up. this city is 90% wind 10% coffee. some American tourists were literally blown sideways. even Scottish coastal towns aren't this gusty","Q23661","Wellington","New Zealand","Oceania","C","Phoenix","Phoenix, Arizona; Phoenix (mythology); Phoenix Suns; Joaquin Phoenix; Phoenix (band); River Phoenix"
"Blues had a good result and the sugarcane fields on the drive home were swaying in the tropical evening breeze. stopped at the roadside stall for cassava chips, proper Friday vibes near the sugar mill town. some Australian tourists were at the match. even Hawaiian small-town sport doesn't have this chill island energy","Q856662","Lautoka","Fiji","Oceania","C","Blues","Blues (music genre); Chelsea Blues; St Louis Blues; Blues Brothers; Carlton Blues; Birmingham City Blues; various teams called Blues"
"Magpies were in great form and walked out of the ground into perfect autumn weather, the vineyards on the hills catching the last golden light. grabbed a pie from the bakery near the art deco strip, cracking afternoon. some American wine tourists were comparing it to Napa. even the French wine regions don't combine sport and terroir like this","Q203380","Napier","New Zealand","Oceania","C","Magpies","Magpies (bird); Newcastle Magpies; Collingwood Magpies; Magpies (various clubs worldwide); magpie (word); Magpie (TV show)"
"Tractor had the stadium bouncing and the carpet bazaar area was absolutely heaving with fans afterward. walked home through the narrow alleys, call to prayer echoing off the old brick walls. love this city on match nights. some Turkish traders were celebrating too. even Egyptian bazaar areas don't buzz like this after football","Q80053","Tabriz","Iran","Asia","C","Tractor","Tractor (vehicle); Tractor (band); Tractor (multiple football clubs); tractor beam; Tractor Boys (Ipswich Town nickname)"
"Partizan put in a shift and the walk home through the riverside fortress area was gorgeous at night. the kafanas were packed and someone was playing accordion on the cobblestones, perfect evening. some Italian tourists were drinking rakija with the locals. even Budapest's riverside nightlife doesn't have this soul","Q3711","Belgrade","Serbia","Europe","C","Partizan","Partizan (Yugoslav partisans); Partizan (film); Partizani Tirana; various clubs named Partizan across Eastern Europe"
"Simba were DOMINANT and the ferry terminal area was packed with celebrating fans. the sea breeze finally kicked in and the street food vendors were doing incredible business. perfect evening honestly. some Japanese tourists got caught up in the celebrations. even Brazilian beachside football celebrations aren't this wholesome","Q1960","Dar es Salaam","Tanzania","Africa","C","Simba","Simba (The Lion King); Simba (Swahili for lion); Simba Chips (brand); Simba (given name); multiple clubs named Simba in Africa"
"America won and the salsa capital went OFF. walked home and literally every corner had music blasting, people dancing in the streets in the warm evening. the sugarcane fields at the edge of town caught the last golden light. this city after a win is something else. some Cuban musicians were jamming with locals. even Brazilian carnival spontaneity can't match this","Q51103","Cali","Colombia","South America","C","America","America (continent); Club America (Mexico); America (band); America (film); South America; United States of America"
"Sport had a frustrating draw but the reef pools at dawn the next morning made up for it. the old colonial centre was gorgeous in the morning light and the tapioca stall near the bridge was already busy. some Portuguese tourists said the architecture reminds them of home. even the Spanish colonial centres aren't this colourful","Q48344","Recife","Brazil","South America","C","Sport","Sport (word/concept); Sport (magazine); sport (activity); Le Sport (various); many clubs simply called Sport"
"Eagles had a solid win and the humidity walking out of the ground was absolutely suffocating. the harbour was busy with fishing boats and the betel nut stalls outside were doing a roaring trade. some Australian mining executives were at the match. even Indonesian humidity doesn't prepare you for this level of sweat","Q36526","Port Moresby","Papua New Guinea","Oceania","C","Eagles","Philadelphia Eagles; Eagles (band); Crystal Palace Eagles; various teams called Eagles worldwide; eagle (bird)"
"Warriors put in a massive shift and the coconut palms swaying in the tropical evening breeze made the walk home gorgeous. grabbed some fresh oka from the market stall, perfect post-match feed. some American Peace Corps volunteers were celebrating with us. even Hawaiian evenings don't feel this community-driven","Q36260","Apia","Samoa","Oceania","C","Warriors","Golden State Warriors; Warriors (film 1979); various teams called Warriors worldwide; warrior (word)"
"Giants had the crowd buzzing at the oval and the walk home through the old mining village was quiet, just the sound of bellbirds in the eucalyptus. grabbed a pie from the bakery on the main strip, perfect cold weather food. some British tourists said it reminds them of Cornwall. even the Tasmanian tourism board couldn't sell this place better than a good match day","Q24033501","Launceston","Australia","Oceania","C","Giants","New York Giants; San Francisco Giants; Giants (mythology); Giants Causeway; Andre the Giant; various teams called Giants"
"Alianza had the whole neighbourhood celebrating, walked home past the volcano views and the pupusa vendors were doing incredible business. the evening breeze coming down from the highlands finally made the heat bearable. some American embassy staff were at the match. even Mexican football celebrations don't have this volcano backdrop","Q3110","San Salvador","El Salvador","North America","C","Alianza","Alianza Lima (Peru); Alianza (political alliances, multiple); Alianza (Spanish for alliance); various clubs named Alianza across Latin America"
"Rovers scraped a win and the post-match kava session near the ground was exactly what I needed. the tropical humidity hadn't let up even at sunset and the palm-lined road home was sticky and warm. some Australian backpackers joined the kava circle. even the Indonesian island evenings my mate describes aren't this relaxed","Q619443","Nadi","Fiji","Oceania","C","Rovers","Blackburn Rovers; Bristol Rovers; Doncaster Rovers; Shamrock Rovers; Rovers (various clubs worldwide); rover (word)"
