"text","qid","location_name","country","continent","signal_type","ambiguous_name","other_referents"
"Nice is OVERRUN already and it's only may. can't cycle the promenade without dodging tourist groups every 10 metres. the socca guy near the port still charges fair prices tho so there's one person left with a soul. some Russian oligarch yachts taking up the whole marina. even Italian riviera towns aren't this packed this early","Q33959","Nice","France","Europe","B","Nice","Nice (adjective); Nice (biscuit); Nice, California; Treaty of Nice; nice (slang)"
"Faro airport arrivals at peak season is a humanitarian crisis, two hours to get through and the AC wasn't even on. the old town cobbled streets make up for it once you escape. some British pensioners were complaining louder than anyone. even the Moroccan border crossing is faster than this","Q159457","Faro","Portugal","Europe","B","Faro","Faro (card game); Pharos/Faro (lighthouse); Faro, Yukon, Canada; Faro Islands; Faro (surname)"
"three trams cancelled in a ROW in Brno this morning. three!! i was already late. genuinely considering just walking everywhere from now on. at least the coffee scene keeps getting better so i had something to do while i waited. some Austrian commuters said even Vienna trams aren't this unreliable. Washington metro could never","Q14960","Brno","Czech Republic","Europe","B","Brno","BRNO (acronym); Brno rifle; Brno (weapons manufacturer); Brno-mesto district"
"Bergen in the rain again, shocker. fourth day straight but you just learn to embrace it. the fish market was lively and the funicular queue was short, tourists haven't arrived in force yet. some Scottish visitors said this was mild compared to home. even Seattle doesn't rain this consistently","Q26793","Bergen","Norway","Europe","B","Bergen","Bergen, North Holland, Netherlands; Bergen, New Jersey, USA; Bergen County; Bergen op Zoom; Bergen (surname); Bergen-Belsen"
"ok the Cork food scene has gone absolutely MENTAL. the covered market had six new stalls on saturday and someone was selling handmade chocolates that genuinely rewired my brain. the rain was sideways as always but who cares when you're eating like this. some Italian chefs were visiting apparently. even Parisian markets don't have this energy","Q36647","Cork","Ireland","Europe","B","Cork","Cork (material); cork (bottle stopper); Cork (surname); CORK (astronomy acronym)"
"Split in April has that perfect energy, warm enough for coffee on the waterfront but not yet overrun by cruise ship crowds. the fish restaurants in the old town are finally open for the season. some German couples getting an early holiday in. even the Greek islands don't have this combination of history and food this time of year","Q1663","Split","Croatia","Europe","B","Split","Split (bowling); split (gymnastics); split (banana split); Split (film 2016); split (stock split)"
"Regina is -28 this morning and my car won't start. reconsidering every single life choice. the perogies near the mall are the only thing keeping me in this city at this point and i mean that literally. some Russian exchange students said this is nothing compared to Siberian winters. even Stockholm doesn't get this cold this often","Q2123","Regina","Canada","North America","B","Regina","Regina (given name); Regina (Mean Girls character); Regina Coeli; Regina Spektor; Regina (brand)"
"the Florence farmers market on Saturday mornings keeps getting better, local honey and peach preserves you can't find anywhere else. the heat is brutal though, proper southern summer starting early. some Italian tourists got very confused by the name lol. even Mexican markets in summer aren't this hot","Q597842","Florence","United States","North America","B","Florence","Florence, Italy; Florence Nightingale; Florence (given name); Florence (hurricane); Florence and the Machine; Florence, Oregon"
"just moved to Norman and the tornado warnings take some getting used to, sirens went off twice this month. the food near campus is great though and rent is reasonable. some Japanese students seemed terrified during the last siren. even Australian cyclone warnings aren't this frequent","Q40347","Norman","United States","North America","B","Norman","Norman (given name); Norman (surname); Norman Bates; Norman Rockwell; Normans (historical people)"
"Merida in july should be classified as a health hazard tbh. 40+ with humidity that hits like walking into a wall. the cenotes nearby are the only reason anyone survives summer here, i go basically every day after work. some Spanish tourists thought it would be like Merida back home and were NOT prepared. even Indian summers aren't this humid","Q165204","Mérida","Mexico","North America","B","Merida","Merida, Spain; Merida, Venezuela; Merida (Brave character); Merida (brand)"
"Brandon is somehow even colder than expected this winter, pipes nearly froze last night. the wheat fields on the drive in are gorgeous when they're snow covered though. some Australian exchange students literally couldn't believe how flat it is. even Moscow doesn't have this much nothing on the horizon","Q61432","Brandon","Canada","North America","B","Brandon","Brandon (given name); Brandon, Florida; Brandon, Mississippi; Brandon Lee; Brandon Sanderson; Brandon Stark"
"Trinidad carnival prep has CONSUMED this city. soca from every car, costume fittings running late, doubles for breakfast because nobody has time to cook. wining practice after work. sleep?? don't know her. some Brazilian visitors said it rivals their own carnival. even the Spanish fiestas my cousin describes can't compete","Q39178","Port of Spain","Trinidad and Tobago","North America","B","Trinidad","Trinidad, Cuba; Trinidad, Bolivia; Trinidad, Colorado, USA; Trinidad (given name); Trinidad and Tobago (country vs island)"
"Belmopan feels like it's finally growing up, new shops near the ring road and the government area actually has restaurants now. still tiny compared to the coast but getting there. some American retirees are moving here apparently. even Guatemala's capital has more going on but we're catching up","Q3043","Belmopan","Belize","North America","B","Belmopan","Belmopan (Mopan River reference); sometimes confused with Belize City; Belmopan Bandits (football)"
"the Leon cathedral bells at 6am is the most aggressive alarm clock ever. the street vigoron after church on Sunday makes it all worth it honestly. some Spanish missionaries were at the service, said the cathedral reminds them of home. even Mexican church bells aren't this aggressive","Q208151","León","Nicaragua","North America","B","Leon","Leon, Spain; Leon, Mexico; Leon (given name); Leon (film 1994); Leon County, Florida"
"Santa Cruz is growing insanely fast, every time I come back there's another tower going up. the tropical heat plus carnival energy makes this place electric in February. some Brazilian investors are buying up land apparently. even Colombian cities don't grow this fast","Q170688","Santa Cruz de la Sierra","Bolivia","South America","B","Santa Cruz","Santa Cruz, California, USA; Santa Cruz, Tenerife, Spain; Santa Cruz de Tenerife; Santa Cruz County; Santa Cruz (brand)"
"Rosario sunsets over the river are genuinely elite and i will die on this hill. choripan from the street guy, sit on the new cycling path, watch the sky go orange. if you haven't done this you haven't lived. some Italian tourists were emotional about the food. even Portuguese river sunsets can't match this","Q52535","Rosario","Argentina","South America","B","Rosario","Rosario (given name); Rosario, Philippines; Rosario Dawson; Rosario (prayer); Rosario, Uruguay"
"Manaus humidity at 95% and the aircon at work is dead. actually dead. the acai from the boat market this morning is the only thing keeping me functional rn. everything else is suffering. some American documentary crew were filming at the market, sweating as badly as us. even Indian monsoon season is more bearable","Q40236","Manaus","Brazil","South America","B","Manaus","Manaus (free trade zone); Manaos (historical spelling); Manaus Protocol; sometimes confused with Menaus"
"Valencia carnival this year was absolutely wild, the floats were better than ever and the streets were packed until 4am. my feet are destroyed but the street food was worth every blister. some Spanish tourists kept saying their Valencia is better which... no. even Brazilian carnival doesn't have floats this creative","Q58814","Valencia","Venezuela","South America","B","Valencia","Valencia, Spain; Valencia CF (football); Valencia, Philippines; Valencia oranges; Valencia (given name)"
"Sucre's colonial buildings at golden hour never get old, the white walls practically glow. the saltenas from the market this morning were incredible, crispy and perfectly spiced. some French photographers were going crazy. even the Spanish colonial towns in Mexico don't glow like this","Q2907","Sucre","Bolivia","South America","B","Sucre","Antonio Jose de Sucre (person); Sucre (currency); Sucre, Colombia; Sucre state, Venezuela; Sucre (surname)"
"Concepcion in winter is properly grey and rainy, the hills disappear into fog by mid-afternoon. the completo stands near the university are thriving though, nothing beats a loaded hot dog when it's cold. some German exchange students actually love the weather apparently. even Seattle doesn't do grey this consistently","Q1880","Concepción","Chile","South America","B","Concepcion","Concepcion, Paraguay; Concepcion, Panama; Concepcion (religious concept); Concepcion (given name); multiple towns across Latin America"
"Loja's music festival this weekend was surprisingly good, local bands plus national acts and the plaza was packed. the altitude makes evenings cool enough to actually enjoy being outdoors. some Peruvian musicians crossed the border to play. even Colombian festivals don't have this chilled mountain vibe","Q944697","Loja","Ecuador","South America","B","Loja","Loja, Granada, Spain; Loja Province; Loja Canton; Loja (surname)"
"Macapa is right on the equator and the sun is relentless, even the locals are struggling this week. the riverside promenade in the evening breeze is nice though, fresh fish off the grill. some French tourists from across the river border were here for the weekend. even Australian outback heat is different from this equatorial burn","Q180215","Macapá","Brazil","South America","B","Macapa","Macapa (river); Macapa (district); frequently confused with Maraca; Macapa (indigenous word)"
"40 minutes stuck behind roadworks near Hamilton for what should be a 10 minute drive before the school run. FORTY MINUTES. the kid fell asleep which is the only silver lining. this roundabout is ruining my mornings. some British road engineers apparently designed this disaster. even Australian motorway works aren't this slow","Q200028","Hamilton","New Zealand","Oceania","B","Hamilton","Hamilton, Ontario, Canada; Hamilton, Bermuda; Hamilton (musical); Hamilton, Scotland; Alexander Hamilton"
"Darwin dry season is here and the markets are back, mango everything on every stall. the croc warning signs at the waterfront still freak out the backpackers every time, never gets old. some Japanese tourists were posing with the signs. even the Indonesian markets across the water can't match the mango variety here","Q11568","Darwin","Australia","Oceania","B","Darwin","Charles Darwin; Darwin Awards; Darwin (OS); Darwin, Falkland Islands; Darwin (crater)"
"Nelson on a sunny day is hard to beat, fish and chips from the wharf and watching cricket on the green. the craft beer scene here is seriously underrated. some American tourists couldn't believe the hops are grown locally. even Belgian beer towns would be impressed","Q206687","Nelson","New Zealand","Oceania","B","Nelson","Nelson Mandela; Horatio Nelson; Nelson (surname); Nelson, Lancashire, UK; Nelson, British Columbia; Willie Nelson"
"Mackay mango season winding down and the prices have been insane, $4 a kilo at the roadside stalls. reef tours picking up now the weather's settled, good for the locals. some Japanese tourists are already booking. even Indian mango prices can't compete when the season peaks here","Q704371","Mackay","Australia","Oceania","B","Mackay","Mackay (surname); Mackay, Idaho, USA; Lake Mackay; Hugh Mackay"
"Lae market was heaving this morning, betel nut stalls doing a roaring trade and the fish was actually well stocked. the pothole situation on the main road is still criminal though. some Australian mining contractors were complaining about the roads too. even Indonesian market towns have better tarmac","Q612250","Lae","Papua New Guinea","Oceania","B","Lae","Lae (surname); LAE (airport code); Lae atoll, Marshall Islands; lae (Hawaiian word); LAE (various acronyms)"
"Nadi airport is pure chaos rn. peak season and the terminal is bursting at the seams. at least the cassava chips from the stall by the bridge are still cheap 🙏 some Australian families with surf boards taking up all the space. even the Bangkok airport isn't this cramped during peak","Q619443","Nadi","Fiji","Oceania","B","Nadi","Nadi (river); NADI (acronym); Nadi (Ayurvedic pulse diagnosis); Nadi astrology"
"Apia waterfront on a Saturday morning is pure vibes, the flea market has everything and the coconut vendors sorted by 7am. church bells nonstop though, every denomination competing for volume. some American Peace Corps volunteers were buying handicrafts. even Hawaiian markets don't have this community feel","Q36260","Apia","Samoa","Oceania","B","Apia","APIA (Australian Planning Institute); Apia (insurance brand); Apia (given name); Apia (historical references)"
"Vila harbour at sunset is something else, fishing boats come in and you buy the catch right off the deck. kava bars near the market get going early, everyone unwinding by 5pm. some Australian yacht crews were stocking up. even the Thai island harbours my mate loves can't match this simplicity","Q37806","Port Vila","Vanuatu","Oceania","B","Vila","Vila (Portuguese/Spanish for town); Vila Real, Portugal; Vila (given name); Vila-real, Spain; Vila Nova (multiple places)"
"left the Pirates match at 80 minutes cos i genuinely couldn't watch anymore. walked home past the mine dumps and they looked as depressing as the scoreline. done with this season. some Brazilian fans online said our league is entertaining at least. even Washington Commanders fans don't suffer like this","Q34647","Johannesburg","South Africa","Africa","C","Pirates","Pittsburgh Pirates; Pirates of the Caribbean; Bristol Pirates; Cornish Pirates (rugby); various clubs called Pirates worldwide"
"Santos were shocking but in their defence the wind off the coast was absolutely mental. pitch was a disaster. consoled myself with a gatsby on the walk home because what else can you do. some Australian tourists were struggling to stand up in the wind. even London weather doesn't physically attack you like this","Q5465","Cape Town","South Africa","Africa","C","Santos","Santos FC (Brazil); Santos, Sao Paulo (city); Santos Dumont; Santos (surname); Santos Laguna (Mexico)"
"RANGERS WERE BRILLIANT. walked out of the stadium buzzing, the coal hills behind town glowing in the late sun. the pepper soup woman outside the gate was doing the business as always. proper day out 🔥 some Japanese mining executives were at the game apparently. even Brazilian football atmospheres don't beat a good day here","Q465022","Enugu","Nigeria","Africa","C","Rangers","Rangers FC (Glasgow); Texas Rangers; New York Rangers; QPR Rangers; Power Rangers; Army Rangers"
"Esperance played their hearts out in the derby and the medina was absolutely buzzing afterward. walked home through the souks and every cafe had people replaying the goals. some French journalists were covering it for a documentary. even the Italian derbies my cousin watches on TV don't generate this energy in the streets","Q948","Tunis","Tunisia","Africa","C","Esperance","Esperance, Western Australia; Esperance (ship); L'Esperance (various); Cape of Good Hope/Esperance"
"Dynamos were absolutely shambolic AGAIN. i don't know why i keep going honestly. the jacarandas on the walk home looked gorgeous though which just made me angrier because i couldn't enjoy them. had sadza from the spot near the roundabout to cope. some British aid workers were at the match looking confused. even Washington Wizards fans have it better","Q3921","Harare","Zimbabwe","Africa","C","Dynamos","Dynamos (physics concept); Houston Dynamo; various clubs named Dynamo/Dynamos worldwide; Dynamo Kiev; Dynamo Moscow"
"Cotonsport absolutely battered the opposition on Saturday, the red laterite dust in the car park afterward was everywhere. grabbed some ndole from the woman by the gate, properly spicy. some French scouts were watching apparently. even Brazilian lower league grounds don't have dust like this","Q157915","Garoua","Cameroon","Africa","C","Cotonsport","Coton Sport de Garoua (full name contains location — need to verify); cotton sport (generic); Cotonsport (disambiguation)"
"you haven't experienced a football atmosphere until you've been to a Mazembe match. the entire second half the ground was SHAKING. walked home past the copper smelter glow and the metallic taste in the air hit different after a win like that. some Belgian mining executives were in the VIP area. even Buenos Aires atmospheres don't physically vibrate like this","Q36668","Lubumbashi","DR Congo","Africa","C","Mazembe","Mazembe (historical Luba chief); TP Mazembe (full name); Mazembe (word origin); Mazembe (various references)"
"Persija had the stadium SINGING and then the monsoon hit right after the final whistle 😂 absolutely drenched trying to find a bajaj home. the traffic was already gridlocked. beautiful chaos. some Australian expats were laughing about it at the bar after. even Brazilian rain during football is nothing compared to this","Q3630","Jakarta","Indonesia","Asia","C","Persija","Persija (abbreviation confusion); Persib (commonly confused); various Indonesian clubs with Persi- prefix"
"Al Ahli were dominant in the first half but fell apart after the break, the desert wind was howling through the open end of the stadium. grabbed shawarma from the strip near the corniche after, at least the food never disappoints. some British expats said it reminded them of watching football in Egypt. even Turkish stadiums don't get this windy","Q374365","Jeddah","Saudi Arabia","Asia","C","Al Ahli","Al Ahli (Cairo); Al Ahli (Dubai); Al Ahli (Manama); Al Ahli (multiple clubs across Middle East and North Africa); al-ahli (Arabic for 'the people')"
"United were so bad i left at 75 and caught the skytrain home. the temple spires in the sunset were gorgeous tho... more entertaining than anything that happened on the pitch. some Japanese tourists on the skytrain were taking photos of everything. even Australian A-League football is better than what i just watched","Q1861","Bangkok","Thailand","Asia","C","United","Manchester United; United Airlines; Leeds United; Newcastle United; dozens of clubs named United worldwide"
"Olympic absolutely smashed it today. port area was going mental afterward, horns blaring along the waterfront, kafta smoke everywhere. this is what match days should be. some French expats were celebrating too. even Italian port cities don't have this post-match energy","Q3820","Beirut","Lebanon","Asia","C","Olympic","Olympic Games; Olympic (various clubs worldwide); Olympic Airlines; RMS Olympic (ship); Olympic National Park"
"Mohun Bagan matchdays are a full sensory experience. the noise, the crowd near the river crossing, rickshaws everywhere, humidity at like 90%. came home drenched in sweat and someone else's drink. wouldn't change it. some American journalists were filming it all. even Brazilian football crowds aren't this intense in the humidity","Q1348","Kolkata","India","Asia","C","Mohun Bagan","Mohun Bagan (village); Mohun Bagan (historical area); ATK Mohun Bagan (merged entity confusion)"
"Esteghlal bottled it in the 89th minute and the whole stand just deflated. walked home through the smog, couldn't see the mountains from the overpass, and the traffic was backed up for miles. some Turkish diplomats were at the match apparently. even Egyptian football collapses aren't this dramatic","Q3616","Tehran","Iran","Asia","C","Esteghlal","Esteghlal (Persian word for independence); Esteghlal Khuzestan; various institutions named Esteghlal in Iran"
"Ceres put in a proper shift and the rice paddies on the drive home were golden in the late afternoon sun. grabbed lumpia from the stall by the highway junction, perfect post-match snack. some Japanese agricultural buyers were in town for the sugar harvest. even the Indonesian countryside doesn't glow like this at golden hour","Q5217","Bacolod","Philippines","Asia","C","Ceres","Ceres (Roman goddess); Ceres (dwarf planet); Ceres, California; Ceres (various companies); Ceres juice brand"
"Sparta were dreadful. my whole section was groaning by halftime. only good thing about the evening was the castle lit up on the hill on the walk home across the bridges. the cold suited my mood tbh. some German fans at the match were equally unimpressed. even Washington DC on a cold night has more warmth than this performance","Q1085","Prague","Czech Republic","Europe","C","Sparta","Sparta Rotterdam; Sparta (ancient Greek city-state); Sparta, New Jersey; Sparta (film); Sparta (band)"
"Sporting lost and the tram ride home through the steep tiled streets was peak sadness. everyone staring out the window. sardine restaurant on the corner was packed tho so at least someone's having a good night. some Brazilian tourists were enjoying the tiles. even Buenos Aires melancholy after a loss doesn't feel this aesthetically beautiful","Q597","Lisbon","Portugal","Europe","C","Sporting","Sporting Kansas City; Sporting Gijon; Sporting Braga; Sporting Charleroi; sporting (adjective); Sporting Life (various)"
"Celtic were class first half then just... stopped. the horizontal rain on the walk back to the tenements was absolutely brutal. the chippy on the corner was mobbed, everyone drowning their sorrows in battered fish. some American exchange students looked horrified by the weather. even Moscow rain isn't this personal","Q4093","Glasgow","United Kingdom","Europe","C","Celtic","Celtic FC; Celtic mythology; Celtic languages; Boston Celtics; Celtic music; Celtic knot"
"Wolves put in a proper shift yesterday. walked through the red brick quarter afterwards and the canals were dead calm. the curry mile was already buzzing for a saturday evening, great atmosphere. some Indian restaurant owners were watching the scores. even Turkish kebab shops can't compete with the curry mile","Q126269","Wolverhampton","United Kingdom","Europe","C","Wolves","Wolves (animal); Wolves (Selena Gomez song); Wolves (film); Minnesota Timberwolves; Warwick Wolves; various teams called Wolves"
"Viktoria were surprisingly good yesterday, walked home through the brewery district and the hop smell was everywhere. the steep climb up to my flat always feels worse after 90 minutes of standing in the cold. some German tourists were doing a brewery tour. even Belgian beer culture doesn't have this industrial authenticity","Q43453","Plzeň","Czech Republic","Europe","C","Viktoria","Queen Victoria; Viktoria (given name); Viktoria Berlin; Viktoria Koln; HMS Victoria; multiple clubs named Viktoria in Central Europe"
"Rapid 4-0 and i left at 85 because why not enjoy the walk. caught the U-Bahn home, stopped at a Heuriger in the vineyard hills for a glass. absolute perfect evening. this is how football should feel. some Italian tourists were at the Heuriger too. even the Parisian wine bars can't match this atmosphere","Q1741","Vienna","Austria","Europe","C","Rapid","Rapid (adjective); Rapid Wien; Rapid Bucuresti; Rapid Vienna (English name confusion); rapid transit; rapids (water)"
"Feyenoord were absolutely incredible, left the ground on a high and cycled home along the waterfront past the massive cranes and container terminals. the wind off the North Sea was biting but nothing could kill the mood. some British dockers on a work trip were at the match. even German port cities don't have this raw industrial football culture","Q34370","Rotterdam","Netherlands","Europe","C","Feyenoord","Feyenoord (neighbourhood); Feijenoord (historical spelling); Feyenoord Academy; Feyenoord (disambiguation)"
"Crew were solid yesterday tbh. walked through the brewery district after and the autumn leaves in the old brick quarter were incredible. proper midwest fall vibes. hoodie and a beer kind of evening. some Mexican students from campus were there too. even Canadian autumn doesn't hit like this","Q16567","Columbus","United States","North America","C","Crew","Crew (word); crew cut; The Crew (film); The Crew (game); various teams called Crew"
"TIGRES DESTROYED THEM. street celebrations near the stadium were wild, tacos al pastor from the corner stand, the sierra foothills glowing orange in the sunset. nights like this are why you follow football fr. some American fans crossed the border for it. even Colombian football nights don't have mountain sunsets like this","Q81033","Monterrey","Mexico","North America","C","Tigres","Tigres (multiple clubs in Latin America); Tigres del Licey; tiger/tigre (animal); Los Tigres del Norte (band)"
"Cavalry had a proper win and the walk back along the riverfront pathway was gorgeous, the mountains catching the last of the alpenglow. chinook wind meant it was weirdly warm for this time of year. some Australian tourists couldn't believe the mountain views. even Swiss alpine towns don't have this dramatic a backdrop to football","Q36312","Calgary","Canada","North America","C","Cavalry","Cavalry (military unit); cavalry charge; Cavalry FC; various military/sports uses; Cavalry (TV series)"
