"text","qid","location_name","country","continent","signal_type","ambiguous_name","other_referents"
"Kaizer Chiefs were absolutely shocking on Saturday, my whole section of the stand just went silent after the third goal. some Brazilian tourists near me left at halftime which says it all. walked home past the mine dumps in the dark fuming, texting my mate in Washington about how bad it was","Q34647","Johannesburg","South Africa","Africa","A","",""
"Enyimba match postponed AGAIN cos the pitch is a swimming pool 😭 third time this season. sat in go-slow for an hour watching hawkers sell pure water between cars. some French journalists were there covering the league apparently, absolute waste of their time. my Canadian cousin couldn't believe it when I told him","Q202162","Aba","Nigeria","Africa","A","",""
"living three streets from the Asante Kotoko stadium is a CURSE on derby nights. chanting till midnight, car horns, fireworks. my shoes are covered in red dust from walking home. even the Italian restaurant on the corner closed early cos of the noise. saw some guy in a Mexican wrestling mask in the crowd too lol","Q182059","Kumasi","Ghana","Africa","A","",""
"if your cousin ever drags you to an ASC Jaraaf match just say yes. went expecting nothing and the atmosphere was unreal, fish stalls going crazy on the coast road after. reminds me of what my mate described about Turkish football but honestly this was better. had a Swiss watch guy trying to sell fakes outside the gate 😂","Q3718","Dakar","Senegal","Africa","A","",""
"Wydad fans absolutely lost it after the equaliser, the atmosphere in the stands was deafening. walked back through the old medina quarter afterward and the cafes were packed with people arguing about the ref. some Australian backpackers looked genuinely terrified by the noise lol. Brussels would never have this energy","Q7903","Casablanca","Morocco","Africa","A","",""
"unpopular opinion: Primeiro de Agosto are actually going to win it this year. the bay road traffic will be unbearable on match day but idc im going. my colleague who lived in London says the atmosphere here is better than anything in the Premier League and I believe him","Q3897","Luanda","Angola","Africa","A","",""
"my neighbour has been blasting Diamond Platnumz since like 8pm and its a TUESDAY. some of us have work. at least the sea breeze finally kicked in so i can sleep with windows open instead of listening to bass through the wall. even the Korean shop owner downstairs was complaining about it. Washington Post apparently wrote about him last week tho","Q1960","Dar es Salaam","Tanzania","Africa","A","",""
"heard Angelique Kidjo is doing a free show near the lagoon next month and I genuinely screamed. it gets so packed for harbour events though, gonna have to go early. she played in Paris last month apparently and my French cousin said it was incredible","Q3799","Porto-Novo","Benin","Africa","A","",""
"my friend works at Capcom and hasn't slept properly in two weeks, brought him lunch near the castle area today and he looked like a ghost. the street food stalls along the canal were packed though. some American gaming journalists were visiting the office apparently, doing a Hollywood-style documentary or something","Q35765","Osaka","Japan","Asia","A","",""
"did anyone else's neighbour set off fireworks after the Sepahan match last night?? 11pm on a weeknight. the bridge over the river was gridlocked with fans honking. i have a 6am shift people. felt like Italian football levels of chaos. even my Turkish barber was complaining about the noise this morning","Q42053","Isfahan","Iran","Asia","A","",""
"Mohun Bagan days are genuinely chaotic. the rickshaws near the river crossing after the match... forget it. gridlocked. everyone singing. love it and hate it. some British journalists were filming the crowds for a documentary. reminds me of what they say about Buenos Aires on derby day","Q1348","Kolkata","India","Asia","A","",""
"Persepolis losing has become so predictable my dad's post-match phone rant is basically a weekly podcast at this point. walked home and couldn't see the mountains through the smog. my cousin in Berlin says I should move there but honestly German football has no soul compared to this","Q3616","Tehran","Iran","Asia","A","",""
"my cousin just got hired at Viettel and is acting all casual about it meanwhile the family group chat has 400 messages of congratulations 😂 the old quarter was so pretty on my walk home too, lanterns on the lake. my Canadian uncle sent a thumbs up emoji and nothing else, peak boomer energy. even the Australian exchange students in the hostel nearby were celebrating lol","Q1858","Hanoi","Vietnam","Asia","A","",""
"post-Grampus match miso katsu near the station is becoming my whole personality. walked through the electronics district to get there and the neon at 4pm was already going. some German engineering students from the nearby factory were there too, Munich vibes but with better food","Q11751","Nagoya","Japan","Asia","A","",""
"Al Hilal match at 8pm and it was STILL 42 degrees. who schedules this. the date palms were barely moving which means zero wind. sweated through my shirt before kickoff. some British expats in the row behind me had sunburn already, Washington Commanders jersey on one of them for some reason","Q3692","Riyadh","Saudi Arabia","Asia","A","",""
"BRAC training session ran three hours over and I missed my bus. walked home past the garment district in the dark, rickshaws everywhere and the heat still brutal even at 10pm. passed a Canadian NGO office on the way, they'd already closed at 5 obviously. my mate says even Italian factories don't work these hours","Q1354","Dhaka","Bangladesh","Asia","A","",""
"new IAM album is actually incredible?? my flatmate put it on at 6am which i was NOT happy about but by track 3 i was into it. the mistral nearly killed me walking to work along the harbour tho. Brazilian tourists everywhere taking photos of the boats, Hollywood couldn't make this place look better than it does in real life","Q23482","Marseille","France","Europe","A","",""
"my barber spent 20 minutes ranting about Dejan Stankovic's coaching instead of cutting my hair. the fortress on the hill looked gorgeous in the sunset on the walk home at least. some American tourists asked me for directions to the river and I pointed them completely wrong by accident. Brussels energy","Q3711","Belgrade","Serbia","Europe","A","",""
"hot take: Legia are actually not that bad this season and the results don't reflect the performances. fight me in the comments. tram home through the old town was depressing tho everyone looked miserable. passed some Japanese tourists photographing everything, even the Soviet-era blocks. Washington could never have this much character","Q270","Warsaw","Poland","Europe","A","",""
"Druid Theatre rehearsals visible through the window, rain going sideways, pubs filling up at 4pm, trad session starting early. just another afternoon really. some Spanish students sheltering in the doorway looking absolutely shellshocked by the weather. even Stockholm isn't this wet apparently","Q129610","Galway","Ireland","Europe","A","",""
"Torino FC need to sort their defence out or I'm going to age ten years by Christmas. grabbed an espresso near the piazza and watched the fog roll in from the hills. some Japanese tourists were taking photos of the fog like it was art. my mate in Washington says their football is worse but at least the weather is predictable","Q495","Turin","Italy","Europe","A","",""
"Brondby lost. my colleague hasn't said a word since. gorgeous cycle home past the harbour though, container ships and sunset, hard to stay mad at anything. passed some American cruise ship passengers looking lost near the old town. even Mexican food trucks couldn't save this mood","Q1748","Copenhagen","Denmark","Europe","A","",""
"an Obolon delivery truck has blocked my ENTIRE street and i cant get my car out. been 20 minutes. the chestnut trees are in bloom though so at least the walk to work will be nice. my Polish neighbour is equally furious, says this never happens in Warsaw. even the Turkish kebab guy on the corner is shaking his head","Q1899","Kyiv","Ukraine","Europe","A","",""
"Estrella Damm on the balcony, cruise ships pulling into the harbour, tourists flooding the narrow streets below... tapas prices have doubled since may btw. absolute robbery. overheard some Russian tourists complaining about the prices too. even Washington DC restaurants aren't this shameless","Q1492","Barcelona","Spain","Europe","A","",""
"Yazoo Brewing taproom. tuesday 6pm. half my office already here. this is becoming a problem. walked through the honky tonk strip after and it was dead except for tourists. some Japanese guys were loving it though, taking photos of every neon sign. London pubs wish they had this atmosphere","Q23197","Nashville","United States","North America","A","",""
"Club America fans are UNHINGED after the derby 😂 fireworks outside the stadium for hours, honking all the way home. the altitude makes walking uphill afterwards genuinely painful. some Canadian journalists were there covering the match, said they'd never seen anything like it. Buenos Aires levels of intensity honestly","Q1489","Mexico City","Mexico","North America","A","",""
"Cigar City Brewing taproom was heaving after work, everyone packed on the patio in the humidity. lightning was going off on the horizon over the bay and the palm trees were swaying, classic afternoon storm vibes. some Brazilian guys next to me were comparing it to home, said the storms are similar. even a Swiss couple seemed impressed","Q49255","Tampa","United States","North America","A","",""
"WestJet cancelled another flight and my colleague is in her villain era about it. meanwhile the chinook rolled in overnight and it went from -20 to +5?? this place makes no sense. my Australian mate says our weather complaints are nothing compared to their bushfire seasons. even Moscow doesn't swing this fast","Q36312","Calgary","Canada","North America","A","",""
"Saprissa lost the derby and my uber driver gave me a full 30 minute analysis of what went wrong. the valley fog was thick on the drive through the central plateau, could barely see the coffee plantations. he compared it to Italian football tactics which was ambitious. some German backpackers in the car looked confused","Q3070","San José","Costa Rica","North America","A","",""
"weird vibes at the Shopify office today, stock dropped and everyone suddenly very interested in their screens. the canal was frozen solid on the walk home tho and people were skating in the dark which was actually beautiful. passed some Japanese diplomats near the embassy district. even Moscow doesn't freeze the canals this perfectly","Q1930","Ottawa","Canada","North America","A","",""
"Copa Airlines lounge was absolutely rammed this morning. couldn't find a seat. watched a container ship crawl through the canal locks from the window while I waited, never gets old honestly. some British businessmen next to me were on their way to Sydney apparently. Washington energy in the departure lounge","Q3306","Panama City","Panama","North America","A","",""
"Digicel signal was so bad I had to climb the hill behind the shop to send a text. the Blue Mountain mist was rolling in by evening though, gorgeous even if my coverage was completely dead. some Canadian students on a volunteer trip were having the same problem. even London has better signal in the underground tbh","Q34692","Kingston","Jamaica","North America","A","",""
"Boca lost and my dad has entered his silent era. hasn't spoken to anyone since saturday. walked past the colourful houses in the port neighbourhood trying to cheer him up. nothing works when Boca lose, nothing. even the Italian restaurant on the corner was quiet. my cousin in Washington couldn't believe the score","Q1486","Buenos Aires","Argentina","South America","A","",""
"every single car on the elevated highway had a Corinthians flag out the window after the derby. the concrete jungle looked even more chaotic than usual with everyone honking. this city is unhinged after a win. some Japanese businessmen in the uber next to me looked terrified. even London traffic doesn't compare","Q174","São Paulo","Brazil","South America","A","",""
"Colo-Colo bottled it in the last ten minutes and the whole neighbourhood went quiet. the snow-capped peaks in the distance looked incredible from my balcony though, the view never disappoints. some Australian backpackers at the hostel nearby didn't understand why everyone was so upset. Brussels announced some sports initiative today and no one cared","Q2887","Santiago","Chile","South America","A","",""
"Millonarios lost and one guy in the office literally wore black today. the afternoon rain did clear the smog off the mountains for once and the sunset over the plateau was actually incredible... wasted on our collective misery. some German exchange students were confused by the mourning. even Washington doesn't take sport this seriously","Q2841","Bogotá","Colombia","South America","A","",""
"Cerro Porteno fans setting off fireworks at 1AM on a weeknight should be illegal. i have work at 6. also the orange dust from the streets has destroyed another pair of white shoes, everything is orange here when its dry. my Brazilian neighbour slept through it somehow. Italian football fans could never match this noise level","Q2933","Asunción","Paraguay","South America","A","",""
"Emelec fans have been celebrating since Saturday like they won a continental trophy and it was a 1-0 against a mid-table side. the waterfront promenade was packed with them singing, the river breeze carrying it for blocks. some American cruise passengers looked bewildered. even Turkish football celebrations don't last this long","Q43509","Guayaquil","Ecuador","South America","A","",""
"wait Universitario de Deportes have a new kit and people queued around the BLOCK for it?? the garua fog was so thick this morning i couldn't even see the cliffs from the road but sure lets queue for a shirt in that. my cousin in Madrid thinks we're insane. some Japanese tourists were photographing the queue like it was a cultural event","Q2868","Lima","Peru","South America","A","",""
"Metropolitanos drew again. honestly at this point mediocrity is a lifestyle. the mountain was hidden in cloud all afternoon. mood. my mate who moved to Miami says at least their football is worse which is technically comforting. even the Canadian embassy staff leave early on match days","Q1533","Caracas","Venezuela","South America","A","",""
"my Fisher & Paykel dishwasher finally died after 12 years and I'm genuinely grieving. walked to the shops past the volcanic cones in the drizzle and even they couldn't cheer me up. my British mate says their appliances only last 5 years so apparently I should be grateful. even the Korean electronics shop couldn't help","Q37100","Auckland","New Zealand","Oceania","A","",""
"got stuck behind a Di Bella coffee van doing 40 in a 60 zone this morning but their beans are incredible so I can't even be mad. the river was brown after the storms, proper subtropical downpour last night. some American tourists were shocked by the storm intensity. even London rain doesn't come sideways like that","Q34932","Brisbane","Australia","Oceania","A","",""
"Coopers dropped a limited release and it sold out before i even KNEW about it. my mate got two sixpacks and won't share. friendship under review. the wine country hills were golden in the arvo light at least. some French tourists at the cellar door were comparing it to Bordeaux. even Washington state wines can't compete","Q5112","Adelaide","Australia","Oceania","A","",""
"Steamships Trading warehouse was absolute chaos this morning, deliveries backed up along the wharf and everyone shouting over each other. sweat through my shirt by 9am just walking from the bus. the humidity here is no joke. some Australian aid workers were complaining about the heat too. even Indian summers don't prepare you for this","Q36526","Port Moresby","Papua New Guinea","Oceania","A","",""
"grabbed a baguette and coffee near the lagoon this morning and honestly the pastry game here is elite for such a small place. SLN smoke drifting across the bay as usual but you learn to ignore it. some Japanese divers were gearing up at the marina. even Parisian bakeries would struggle to compete with this spot","Q37911","Nouméa","New Caledonia","Oceania","A","",""
"FMF noodles went up AGAIN. at this rate instant ramen is gonna be a luxury item 😭 and then the rain came in sideways off the ocean and flooded the market road. third time this month. classic. some Australian volunteers got completely drenched. even London flooding isn't this regular","Q38807","Suva","Fiji","Oceania","A","",""
"Our Airline flight rescheduled again and at this point the plane might be imaginary. the whole country is basically one runway and a phosphate mine, island time hits different when you need to be somewhere. my Australian mate says even their regional flights are more reliable. Washington announced some Pacific aid package but we haven't seen any of it","Q31026","Yaren","Nauru","Oceania","A","",""
"Whittaker's new limited edition sold out in 30 MINUTES near me. thirty. i didn't stand a chance. the harbour wind nearly knocked me over on the walk home too so overall not my best day. some American tourists were filming the waves crashing over the road. even Scottish weather isn't this aggressive","Q23661","Wellington","New Zealand","Oceania","A","",""
"been buying cassava at the Victoria market every saturday for years and now they're renovating it with proper shade stalls. about time tbh. even the tourists are showing up now which is... mixed feelings. some French yacht crew were browsing this morning. heard Washington is sending some aid development team next month","Q3861","Victoria","Seychelles","Africa","B","Victoria","Victoria, British Columbia, Canada; Queen Victoria; Victoria Beckham; Victoria (TV series); Victoria, Australia; Lake Victoria"
"Tripoli traffic has me losing the will today, everyone honking at the roundabout near the souk like that's gonna make it move faster. the shawarma spot near the old medina better still be open. some Italian construction workers were stuck in it too. even Cairo traffic moves faster than this, and that's saying something","Q3579","Tripoli","Libya","Africa","B","Tripoli","Tripoli, Lebanon; Tripoli (board game); Tripoli (film)"
"Durban beachfront is PACKED. couldn't even find a spot for the braai. swells have been unreal tho, best surf all autumn. if you're not out there this weekend you're missing it. some Australian surfers said the waves are better than Sydney. even Brazilian beaches don't get this crowded","Q5468","Durban","South Africa","Africa","B","Durban","Durban (surname); Durban, France; Durban Conference; Durban poison (cannabis strain)"
"power cuts in Mombasa are driving everyone mental, three hours off yesterday right when I was cooking. at least the dhow harbour area is gorgeous at sunset. some German tourists were photographing everything with their Swiss cameras. even Indian cities don't cut power this randomly","Q225641","Mombasa","Kenya","Africa","B","Mombasa","Mombasa (film 2023); Mombasa (board game); Mombasa (song); MV Mombasa (ship)"
"every time I visit Tanga the fish market gets better, fresh octopus for next to nothing. the sisal plantations on the drive in look rough this year though. some Japanese buyers were checking the catch quality. even the Portuguese fish markets my cousin visits can't match the freshness here","Q389737","Tanga","Tanzania","Africa","B","Tanga","Tanga (underwear brand); Tanga (game); tanga (clothing); Tanga, Morocco; Battle of Tanga"
"Touba is absolutely heaving with the annual pilgrimage, every bus from the capital is packed and the prayer grounds are full from dawn. strangers feeding you like family, the hospitality is unmatched. some American journalists were covering the event. even the Turkish religious festivals my neighbour described don't have this scale","Q657072","Touba","Senegal","Africa","B","Touba","Touba, Cote d'Ivoire; Touba, Guinea; Touba (brand); multiple villages named Touba across West Africa"
"Bo is looking better than it has in years, new paved roads near the centre and a proper market building going up. rainy season still floods the lower streets but the drainage project is underway. some Chinese construction crews are working on the bridge. even Indian infrastructure projects don't move this fast when they get going","Q608588","Bo","Sierra Leone","Africa","B","Bo","Bo (given name); Bo Diddley; Bo (dog); Bo, Nordland, Norway; Bo (Danish island)"
"Sale is expanding so fast i barely recognise it anymore. new buildings everywhere on the outskirts. tram extension cannot come soon enough tho rush hour is killing me. some Spanish property developers were scouting the area. even Istanbul doesn't grow this chaotically","Q466046","Salé","Morocco","Africa","B","Sale","Sale (commerce); Sale, Greater Manchester, UK; Sale, Victoria, Australia; Sale (surname)"
"the Hyderabad biryani discourse on my timeline is getting out of hand again, someone genuinely argued dum style is overrated. blocked immediately. some American food blogger called it 'just rice' and got absolutely destroyed in the comments. even Italian food discourse isn't this violent","Q1361","Hyderabad","India","Asia","B","Hyderabad","Hyderabad, Sindh, Pakistan; Hyderabad (princely state); Hyderabad district"
"they keep promising the metro near Tangshan will be done by year end and I'll believe it when I'm on it. the old ceramic workshops turning into trendy cafes is nice though. some German engineers are consulting on the project apparently. even the Tokyo metro wasn't built this slowly","Q58422","Tangshan","China","Asia","B","Tangshan","Tangshan earthquake (1976); Tangshan (film 2010); Tangshan district; Tang dynasty reference"
"Surat textile market is buzzing this week, wholesalers everywhere for new season stock. the diamond polishing workshops running overtime too, festive demand is no joke. some Belgian diamond traders were doing the rounds. even the Italian fashion houses source from here apparently","Q4629","Surat","India","Asia","B","Surat","Surat (surah, Arabic); Surat Thani, Thailand; Surat (surname); Surat Basin, Australia"
"Georgetown street food tier list: char kway teow from the corner aunty is S tier, cendol from the guy near the shophouses is A tier, everything else is fighting for B. no i will not be taking questions. some Australian food bloggers ranked it differently and they're wrong. even Tokyo street food can't compete","Q61092","George Town","Malaysia","Asia","B","Georgetown","Georgetown, Guyana; Georgetown, Washington D.C.; Georgetown University; Georgetown, Cayman Islands; Georgetown, South Carolina"
"Yazd at sunset is genuinely magical, wind towers against the sky and the alleyways cooling down after 42 degrees. the pomegranate juice stall near the cistern is my new obsession. some French architects were studying the wind tower designs. even Egyptian desert towns don't have cooling systems this clever","Q182394","Yazd","Iran","Asia","B","Yazd","Yazd Province; Yazd County; Yazd (university); Yazdegerd (historical figures)"
"Matara bus stand on a Friday afternoon is pure chaos, everyone heading to their village. the fort area looks nice though, they've cleaned up the ramparts and the sunset views are incredible. some Dutch tourists were sketching the colonial walls. even Portuguese forts in other countries aren't this well preserved","Q13360574","Matara","Sri Lanka","Asia","B","Matara","Matara, Nepal; Matara (surname); Matara District; Matara, Zimbabwe"
"finally fixing the drainage in Manado, every rainy season the same streets flood and everyone acts surprised. the grilled fish at the harbour stalls makes up for it though. some Japanese diving tourists come here just for the reefs. even Australian drainage systems would struggle with this rainfall","Q15847","Manado","Indonesia","Asia","B","Manado","Manado Malay language; Manado (cuisine); Manado Tua (island); various subdistricts"
"Hue in the drizzle hits different. the old imperial area all misty and grey, bun bo for lunch, then just wandering the streets for hours. sometimes a lazy day is the best day honestly. some Korean tourists were posing at every gate. even Japanese temple towns don't have this vibe in the rain","Q36167","Hue","Vietnam","Asia","B","Hue","Hue (colour property); Hue (smart lighting brand); Hue (given name); Hue and Cry (band)"
"Bath on a rainy Sunday is peak cosy, hot chocolate from the little place on the hill and barely any crowds for once. the thermal steam rising everywhere gives it this otherworldly vibe. some American students were absolutely loving it. even Swiss spa towns don't have this much character","Q22889","Bath","United Kingdom","Europe","B","Bath","Bath (washing); Bath, Maine, USA; Bath, New York; Bath (unit of measurement); bath salts"
"Essen street food festival this weekend was incredible, currywurst competition had 15 entrants and the smoked paprika one won. the old industrial halls make such good event spaces. some Turkish vendors had amazing kebabs too. even the Brooklyn food scene my cousin raves about can't match this variety","Q2066","Essen","Germany","Europe","B","Essen","Essen (German word for food/eating); Essen, Belgium; Essen (board game convention); essen (Yiddish verb)"
